Index,Text,Sentiment,Timestamp,User,Platform,Hashtags,Retweets,Likes,Country,Year,Month,Day,Hour
1,Enjoyingabeautifuldayatthepark!,Positive,1/15/2023 12:30,User123,Twitter, #Nature #Park,15,30,USA,2023,1,15,12
2,Trafficwasterriblethismorning.,Negative,1/15/2023 8:45,CommuterX,Twitter, #Traffic #Morning,5,10,Canada,2023,1,15,8
3,Justfinishedanamazingworkout!,Positive,1/15/2023 15:45,FitnessFan,Instagram, #Fitness #Workout,20,40,USA,2023,1,15,15
4,Excitedabouttheupcomingweekendgetaway!,Positive,1/15/2023 18:20,AdventureX,Facebook, #Travel #Adventure,8,15,UK,2023,1,15,18
5,Tryingoutanewrecipefordinnertonight.,Neutral,1/15/2023 19:55,ChefCook,Instagram, #Cooking #Food,12,25,Australia,2023,1,15,19
6,Feelinggratefulforthelittlethingsinlife.,Positive,1/16/2023 9:10,GratitudeNow,Twitter, #Gratitude #PositiveVibes,25,50,India,2023,1,16,9
7,Rainydayscallforcozyblanketsandhotcocoa.,Positive,1/16/2023 14:45,RainyDays,Facebook, #RainyDays #Cozy,10,20,Canada,2023,1,16,14
8,Thenewmoviereleaseisamust-watch!,Positive,1/16/2023 19:30,MovieBuff,Instagram, #MovieNight #MustWatch,15,30,USA,2023,1,16,19
9,Politicaldiscussionsheatinguponthetimeline.,Negative,1/17/2023 8:00,DebateTalk,Twitter, #Politics #Debate,30,60,USA,2023,1,17,8
10,Missingsummervibesandbeachdays.,Neutral,1/17/2023 12:20,BeachLover,Facebook, #Summer #BeachDays,18,35,Australia,2023,1,17,12
11,Justpublishedanewblogpost.Checkitout!,Positive,1/17/2023 15:15,BloggerX,Instagram, #Blogging #NewPost,22,45,USA,2023,1,17,15
12,Feelingabitundertheweathertoday.,Negative,1/18/2023 10:30,WellnessCheck,Twitter, #SickDay #Health,7,15,Canada,2023,1,18,10
13,Exploringthecity'shiddengems.,Positive,1/18/2023 14:50,UrbanExplorer,Facebook, #CityExplore #HiddenGems,12,25,UK,2023,1,18,14
14,"Newyear,newfitnessgoals!",Positive,1/18/2023 18:00,FitJourney,Instagram, #NewYear #FitnessGoals,28,55,USA,2023,1,18,18
15,Technologyischangingthewaywelive.,Neutral,1/19/2023 9:45,TechEnthusiast,Twitter, #Tech #Innovation,15,30,India,2023,1,19,9
16,Reflectingonthepastandlookingahead.,Positive,1/19/2023 13:20,Reflections,Facebook, #Reflection #Future,20,40,USA,2023,1,19,13
17,Justadoptedacutefurryfriend!,Positive,1/19/2023 17:10,PetAdopter,Instagram, #PetAdoption #FurryFriend,15,30,Canada,2023,1,19,17
18,Late-nightgamingsessionwithfriends.,Positive,1/20/2023 0:05,GamerX,Twitter, #Gaming #LateNight,18,35,UK,2023,1,20,0
19,AttendingavirtualconferenceonAI.,Neutral,1/20/2023 11:30,TechConference,Facebook, #AI #TechConference,25,50,USA,2023,1,20,11
20,Winterbluesgotmefeelinglow.,Negative,1/20/2023 15:15,WinterBlues,Instagram, #WinterBlues #Mood,8,15,USA,2023,1,20,15
21,Sippingcoffeeandenjoyingagoodbook.,Positive,1/21/2023 8:40,Bookworm,Twitter, #Reading #CoffeeTime,22,45,India,2023,1,21,8
22,Exploringtheworldofvirtualreality.,Positive,1/21/2023 13:20,VRExplorer,Facebook, #VR #VirtualReality,15,30,USA,2023,1,21,13
23,Productivedaytickingoffmyto-dolist.,Positive,1/21/2023 16:45,ProductivityPro,Instagram, #Productivity #WorkFromHome,30,60,USA,2023,1,21,16
24,Justfinishedachallengingworkoutroutine.,Positive,1/22/2023 9:15,FitnessWarrior,Twitter, #Fitness #ChallengeAccepted,20,40,UK,2023,1,22,9
25,Celebratingamilestoneatwork!,Positive,1/22/2023 14:30,CareerMilestone,Facebook, #Career #Milestone,12,25,Canada,2023,1,22,14
26,Sundaybrunchwithfriends.,Positive,1/22/2023 12:00,BrunchBuddy,Instagram, #Brunch #Friends,15,30,UK,2023,1,22,12
27,Learninganewlanguageforpersonalgrowth.,Positive,1/23/2023 16:20,LanguageLearner,Facebook, #LanguageLearning #PersonalGrowth,25,50,India,2023,1,23,16
28,Quieteveningwithagoodbook.,Positive,1/23/2023 19:45,BookLover,Instagram, #Reading #QuietTime,15,30,Australia,2023,1,23,19
29,Reflectingontheimportanceofmentalhealth.,Positive,1/24/2023 11:30,MentalHealthMatters,Twitter, #MentalHealth #SelfCare,22,45,USA,2023,1,24,11
30,Newpaintinginprogress!,Positive,1/24/2023 15:00,ArtistInAction,Facebook, #Art #PaintingInProgress,12,25,Canada,2023,1,24,15
31,Weekendroadtriptoexplorescenicviews.,Positive,1/24/2023 17:30,RoadTripper,Instagram, #RoadTrip #ScenicViews,18,35,UK,2023,1,24,17
32,Enjoyingacupofteaandwatchingthesunset.,Positive,1/25/2023 18:00,SunsetWatcher,Twitter, #TeaTime #Sunset,15,30,India,2023,1,25,18
33,Codinganewprojectwithenthusiasm.,Positive,1/25/2023 13:15,CodeEnthusiast,Facebook, #Coding #Enthusiasm,30,60,USA,2023,1,25,13
34,Feelinginspiredafterattendingaworkshop.,Positive,1/26/2023 9:45,WorkshopAttendee,Instagram, #Inspiration #Workshop,25,50,USA,2023,1,26,9
35,Wintersportsdayatthelocalpark.,Positive,1/26/2023 14:20,WinterSports,Twitter, #WinterSports #Fun,15,30,Canada,2023,1,26,14
36,Qualitytimewithfamilythisweekend.,Positive,1/26/2023 17:40,FamilyTime,Facebook, #FamilyTime #Weekend,22,45,UK,2023,1,26,17
37,Attendingalivemusicconcerttonight.,Positive,1/27/2023 20:00,MusicLover,Instagram, #Music #ConcertNight,18,35,USA,2023,1,27,20
38,Practicingmindfulnesswithmeditation.,Positive,1/27/2023 12:30,MindfulMoments,Twitter, #Mindfulness #Meditation,15,30,India,2023,1,27,12
39,Tryingoutanewdessertrecipe.,Positive,1/27/2023 16:10,DessertExplorer,Facebook, #Dessert #Cooking,12,25,Canada,2023,1,27,16
40,Excitedabouttheupcominggamingtournament.,Positive,1/28/2023 9:00,GamingEnthusiast,Instagram, #Gaming #Tournament,30,60,USA,2023,1,28,9
41,Planningagardenmakeoverforspring.,Positive,1/28/2023 14:45,GardenPlanner,Twitter, #Gardening #Spring,25,50,USA,2023,1,28,14
42,Celebratingafriend'sbirthdaytonight!,Positive,1/28/2023 19:30,BirthdayBash,Facebook, #Birthday #Celebration,15,30,UK,2023,1,28,19
43,Feelingaccomplishedafteraproductiveday.,Positive,1/29/2023 17:00,ProductivityWin,Instagram, #Accomplished #Success,22,45,India,2023,1,29,17
44,Acozyeveningwithagoodmovie.,Positive,1/29/2023 20:20,MovieNight,Twitter, #CozyNight #MovieTime,18,35,Canada,2023,1,29,20
45,Exploringlocalartgalleriesthisweekend.,Positive,1/30/2023 11:30,ArtExplorer,Facebook, #Art #GalleryExplore,15,30,USA,2023,1,30,11
46,Newbookreleasefrommyfavoriteauthor!,Positive,1/30/2023 15:45,BookwormX,Instagram, #BookRelease #FavoriteAuthor,12,25,UK,2023,1,30,15
47,Attendingavirtualrealitymeetup.,Positive,1/30/2023 18:30,VRMeetup,Twitter, #VRMeetup #VirtualReality,28,55,India,2023,1,30,18
48,Reflectingonthebeautyofnature.,Positive,1/31/2023 10:45,NatureLover,Facebook, #Nature #Reflection,15,30,Australia,2023,1,31,10
49,Cookingaspecialdinnerforlovedones.,Positive,1/31/2023 19:00,ChefAtHome,Instagram, #Cooking #SpecialDinner,20,40,USA,2023,1,31,19
50,Feelingoptimisticabouttheweekahead.,Positive,1/31/2023 16:20,OptimisticMindset,Twitter, #Optimism #NewWeek,15,30,Canada,2023,1,31,16
51,Startinganewfitnesschallengetomorrow!,Positive,2/1/2023 8:00,FitnessChallenge,Facebook, #FitnessChallenge #NewBeginnings,22,45,UK,2023,2,1,8
52,Sundaybikeridethroughscenictrails.,Positive,2/1/2023 13:30,BikeExplorer,Instagram, #BikeRide #ScenicTrails,18,35,USA,2023,2,1,13
53,Can'tbelievetheinjusticehappeninginoursociety.,Anger,2/11/2023 9:30,SocialJustice,Twitter, #Injustice #Angry,20,40,Canada,2023,2,11,9
54,Feelingasenseoffearafterwatchingathrillermovie.,Fear,2/11/2023 21:15,ThrillerFan,Instagram, #Fear #ThrillerMovie,15,30,USA,2023,2,11,21
55,Heartbrokenafterhearingthenewsaboutanaturaldisaster.,Sadness,2/12/2023 14:45,EmpathyFirst,Facebook, #Sadness #NaturalDisaster,25,50,India,2023,2,12,14
56,Thestateoftheworld'senvironmentisjustdisgusting.,Disgust,2/12/2023 18:20,EcoAwareness,Twitter, #Disgust #Environment,18,35,UK,2023,2,12,18
57,Purehappiness:celebratingalovedone'sachievement!,Happiness,2/13/2023 10:00,ProudFriend,Instagram, #Happiness #Celebration,30,60,USA,2023,2,13,10
58,Laughteristhebestmedicineenjoyingacomedyshow.,Joy,2/13/2023 19:30,ComedyFan,Facebook, #Joy #ComedyShow,22,45,Canada,2023,2,13,19
59,Anamusingincidentbrightenedupmyday!,Amusement,2/14/2023 14:20,AmusedSoul,Instagram, #Amusement #FunTimes,18,35,UK,2023,2,14,14
60,Enjoyingaquieteveningwithabookandsometea.,Enjoyment,2/14/2023 19:45,BookLoverAgain,Facebook, #Enjoyment #BookTime,25,50,Canada,2023,2,14,19
61,Admiringthebeautyofnatureduringapeacefulhike.,Admiration,2/15/2023 11:30,NatureAdmirer,Twitter, #Admiration #Nature,20,40,USA,2023,2,15,11
62,Sendingaffectionatevibestoallmyfollowers!,Affection,2/15/2023 16:00,AffectionSender,Instagram, #Affection #PositiveVibes,15,30,USA,2023,2,15,16
63,Experiencingaweatthebreathtakingsunset.,Awe,2/15/2023 20:30,AweStruck,Facebook, #Awe #Breathtaking,22,45,Australia,2023,2,15,20
64,Disappointedwiththeserviceatalocalrestaurant.,Disappointed,2/16/2023 9:00,FoodieGoneWrong,Twitter, #Disappointed #BadService,18,35,India,2023,2,16,9
65,Asurprisegiftfromafriendmademyday!,Surprise,2/16/2023 14:45,HappySurprise,Instagram, #Surprise #Gift,25,50,USA,2023,2,16,14
66,Findingacceptanceinthemidstoflife'schallenges.,Acceptance,2/16/2023 18:20,AcceptanceSeeker,Facebook, #Acceptance #Challenges,15,30,Canada,2023,2,16,18
67,Overflowingwithadorationformyadorablepet!,Adoration,2/17/2023 10:45,PetAdorer,Twitter, #Adoration #PetLove,22,45,UK,2023,2,17,10
68,Anticipatingathrillingadventureinthecomingweeks.,Anticipation,2/17/2023 7:30,AdventureAwaits,Instagram, #Anticipation #Adventure,20,40,USA,2023,2,17,7
69,Abitterexperienceturnedintoavaluablelesson.,Bitter,2/17/2023 15:00,LearnFromBitter,Facebook, #BitterLesson #Growth,18,35,USA,2023,2,17,15
70,Findingcalmnessinthemidstofabusyday.,Calmness,2/18/2023 9:30,ZenMaster,Twitter, #Calmness #PeacefulMind,15,30,India,2023,2,18,9
71,ConfusioncloudsmymindasInavigatethroughdecisions.,Confusion,2/18/2023 14:20,ConfusedMind,Instagram, #Confusion #DecisionMaking,25,50,UK,2023,2,18,14
72,Excitementbuildingupfortheupcomingvacation!,Excitement,2/18/2023 18:45,VacationDreamer,Facebook, #Excitement #TravelPlans,22,45,Canada,2023,2,18,18
73,Kindnesswitnessedtodayrestoredmyfaithinhumanity.,Kind,2/19/2023 11:30,KindnessPrevails,Twitter, #Kindness #Humanity,20,40,USA,2023,2,19,11
74,Prideinachievingapersonalmilestone.,Pride,2/19/2023 16:00,PersonalAchiever,Instagram, #Pride #Milestone,30,60,Australia,2023,2,19,16
75,Amomentofshamefornotstandingupagainstinjustice.,Shame,2/19/2023 19:45,ReflectiveSelf,Facebook, #Shame #Injustice,15,30,India,2023,2,19,19
76,Fumingwithangerafteraheatedargument.,Anger,2/20/2023 9:30,AngryDebater,Twitter, #Anger #Argument,20,40,Canada,2023,2,20,9
77,Thefearoftheunknowniskeepingmeupatnight.,Fear,2/20/2023 21:15,FearfulDreamer,Instagram, #Fear #Unknown,15,30,USA,2023,2,20,21
78,Heartfeltsadnessafterbiddingfarewelltoadearfriend.,Sadness,2/21/2023 14:45,FarewellHeart,Facebook, #Sadness #Farewell,25,50,India,2023,2,21,14
79,Thestateofcorruptioninoursocietyisutterlydisgusting.,Disgust,2/21/2023 18:20,AntiCorruption,Twitter, #Disgust #Corruption,18,35,UK,2023,2,21,18
80,Overflowinghappiness:welcominganewfamilymember!,Happiness,2/22/2023 10:00,NewParentJoy,Instagram, #Happiness #NewFamilyMember,30,60,UK,2023,2,22,10
81,Laughteristhekeytojoyattendingastand-upcomedyshow.,Joy,2/22/2023 19:30,StandUpFan,Facebook, #Joy #StandUpComedy,22,45,Canada,2023,2,22,19
82,Amusedbytheanticsofmypetit'spureamusement!,Amusement,2/23/2023 14:20,PetAmuser,Instagram, #Amusement #PetAntics,18,35,UK,2023,2,23,14
83,Enjoyingeverymomentofthistrippureenjoyment!,Enjoyment,2/23/2023 19:45,TravelExplorer,Facebook, #Enjoyment #Travel,25,50,USA,2023,2,23,19
84,Admiringthededicationofvolunteersatalocalcharity.,Admiration,2/24/2023 11:30,CharityAdmirer,Twitter, #Admiration #Volunteers,20,40,USA,2023,2,24,11
85,Sendingaffectionatevibestofriendsandfamily.,Affection,2/24/2023 16:00,FamilyLover,Instagram, #Affection #FamilyLove,15,30,USA,2023,2,24,16
86,Awe-struckbythebeautyofthenightsky.,Awe,2/24/2023 20:30,Stargazer,Facebook, #Awe #StarryNight,22,45,Australia,2023,2,24,20
87,Disappointedwiththelackofprogressinapersonalproject.,Disappointed,2/25/2023 9:00,ProjectStruggle,Twitter, #Disappointed #Project,18,35,India,2023,2,25,9
88,Asurprisevisitfromanoldfriendbroughttearsofjoy.,Surprise,2/25/2023 14:45,JoyfulReunion,Instagram, #Surprise #OldFriends,25,50,USA,2023,2,25,14
89,Embracingacceptanceoflife'supsanddowns.,Acceptance,2/25/2023 18:20,LifeAcceptance,Facebook, #Acceptance #LifeJourney,15,30,Canada,2023,2,25,18
90,Overflowingadorationforacuterescuepuppy!,Adoration,2/26/2023 10:45,PuppyAdmirer,Twitter, #Adoration #PuppyLove,22,45,UK,2023,2,26,10
91,Anticipatingthereleaseofamuch-awaitedmovie.,Anticipation,2/26/2023 7:30,MovieBuff2,Instagram, #Anticipation #MovieRelease,20,40,Australia,2023,2,26,7
92,Bitterexperienceatthecustomerservicedepartment.,Bitter,2/26/2023 15:00,CustomerWoes,Facebook, #BitterExperience #CustomerService,18,35,USA,2023,2,26,15
93,Findingcalmnessamidstthechaosofdailylife.,Calmness,2/27/2023 9:30,CalmSoul,Twitter, #Calmness #InnerPeace,15,30,India,2023,2,27,9
94,ConfusionreignsasItrytomakesenseofrecentevents.,Confusion,2/27/2023 14:20,ConfusedMind2,Instagram, #Confusion #MakingSense,25,50,UK,2023,2,27,14
95,Excitementbuildingupforasurprisebirthdayparty.,Excitement,2/27/2023 18:45,BirthdayExcite,Facebook, #Excitement #SurpriseParty,22,45,Canada,2023,2,27,18
96,Witnessedanactofkindnessthatmademyday.,Kind,2/28/2023 11:30,KindnessObserver,Twitter, #Kindness #ActsOfKindness,20,40,USA,2023,2,28,11
97,Prideincompletingachallengingfitnesschallenge.,Pride,2/28/2023 16:00,FitAchiever,Instagram, #Pride #FitnessChallengeCompleted,30,60,UK,2023,2,28,16
98,Amomentofshamefornotspeakingupagainstinjustice.,Shame,2/28/2023 19:45,ReflectiveSelf2,Facebook, #Shame #Injustice,15,30,India,2023,2,28,19
99,Reflectingonthebeautyofdiversityinourworld.,Acceptance,3/1/2023 10:45,DiversityLover,Twitter, #Acceptance #Diversity,22,45,Australia,2023,3,1,10
100,Excitementforaquieteveningwithagoodbook.,Excitement,3/1/2023 13:30,BookwormJoy,Instagram, #Excitement #BookTime,18,35,USA,2023,3,1,13
101,Feelingbitterabouttheunfairnessintheworkplace.,Bitter,3/1/2023 17:45,WorkplaceWoes,Twitter, #Bitter #Unfairness,15,30,Canada,2023,3,1,17
102,CalmnessprevailsasIpracticemindfulness.,Calmness,3/2/2023 18:00,MindfulMe,Facebook, #Calmness #Mindfulness,15,30,UK,2023,3,2,18
103,ConfusionsurroundsmeasInavigatethroughlife'schoices.,Confusion,3/2/2023 13:15,ConfusedMind3,Instagram, #Confusion #LifeChoices,30,60,USA,2023,3,2,13
104,Excitementforaweekendroadtriptoexplorenewplaces.,Excitement,3/2/2023 16:45,RoadTripper2,Twitter, #Excitement #WeekendAdventure,25,50,India,2023,3,2,16
105,Kindnesswitnessedtodayrestoresmyfaithinhumanity.,Kind,3/3/2023 11:30,KindnessPrevails2,Facebook, #Kindness #HumanityRestored,22,45,USA,2023,3,3,11
106,Prideinaccomplishingpersonalandprofessionalgoals.,Pride,3/3/2023 14:30,GoalAchiever,Instagram, #Pride #Accomplishments,12,25,Canada,2023,3,3,14
107,Shamefornotbeingtruetomyvaluesinadifficultsituation.,Shame,3/3/2023 12:00,ReflectiveSelf3,Twitter, #Shame #Integrity,15,30,UK,2023,3,3,12
108,"Revisitingoldmemories,feelingasenseofelation.",Elation,5/15/2010 15:30,NostalgiaFan,Twitter, #Elation #Memories,20,40,Canada,2010,5,15,15
109,Thevictoryofourteambroughteuphoriatothecity.,Euphoria,8/10/2021 21:15,SportsFanatic,Instagram, #Euphoria #Victory,15,30,USA,2021,8,10,21
110,"Embracingthebeautyofnature,amomentofcontentment.",Contentment,6/20/2011 14:45,NatureLover2,Facebook, #Contentment #Nature,25,50,India,2011,6,20,14
111,"Meditatingbytheserenelake,findinginnerpeace.",Serenity,2/12/2022 18:20,ZenMaster2,Twitter, #Serenity #Meditation,18,35,UK,2022,2,12,18
112,Overflowingwithgratitudeforlife'sblessings.,Gratitude,11/25/2012 10:00,ThankfulHeart,Instagram, #Gratitude #Blessed,30,60,Australia,2012,11,25,10
113,"Hopefulforabrightertomorrow,despitechallenges.",Hope,4/5/2013 19:30,OptimisticSoul,Facebook, #Hope #Optimism,22,45,USA,2013,4,5,19
114,Empoweredtomakeadifferenceinmycommunity.,Empowerment,9/14/2014 8:30,CommunityLeader,Twitter, #Empowerment #Community,15,30,UK,2014,9,14,8
115,Compassioninaction:supportingalocalcharityevent.,Compassion,7/18/2015 14:20,CharitySupporter,Instagram, #Compassion #CharityEvent,18,35,Canada,2015,7,18,14
116,"Amomentoftenderness,connectingwithlovedones.",Tenderness,2/23/2016 19:45,LovingHeart,Facebook, #Tenderness #FamilyTime,25,50,UK,2016,2,23,19
117,ArousalofexcitementasIawaitaspecialannouncement.,Arousal,10/30/2017 11:30,ExcitementFan,Twitter, #Arousal #Excitement,20,40,Australia,2017,10,30,11
118,Enthusiasticallydivingintoanewproject.,Enthusiasm,6/15/2018 16:00,ProjectEnthusiast,Instagram, #Enthusiasm #NewProject,15,30,USA,2018,6,15,16
119,Feelingasenseoffulfillmentafterreachingamilestone.,Fulfillment,3/28/2019 18:20,MilestoneAchiever,Facebook, #Fulfillment #Milestone,22,45,India,2019,3,28,18
120,Reverenceforthebeautyofahistoriclandmark.,Reverence,11/11/2019 15:00,HistoryLover,Twitter, #Reverence #History,18,35,UK,2019,11,11,15
121,Elationafterasurprisereunionwitholdfriends.,Elation,4/2/2020 9:30,JoyfulReunion2,Instagram, #Elation #OldFriends,25,50,Canada,2020,4,2,9
122,Theeuphoriaofalivemusicconcertunderthestars.,Euphoria,6/19/2021 14:45,MusicEnthusiast,Facebook, #Euphoria #LiveMusic,15,30,USA,2021,6,19,14
123,ContentmentinthesimplicityofaquietSunday.,Contentment,8/15/2010 10:00,SimpleJoys,Twitter, #Contentment #SundayMood,30,60,Australia,2010,8,15,10
124,Serenityfoundinthepagesofafavoritebook.,Serenity,9/22/2011 19:30,BookLover3,Instagram, #Serenity #BookTime,22,45,UK,2011,9,22,19
125,Gratitudeforthesupportreceivedduringtoughtimes.,Gratitude,3/10/2012 8:30,SupportiveFriend,Facebook, #Gratitude #Supportive,15,30,India,2012,3,10,8
126,Hopefulaboutthepossibilitiesofanewjourney.,Hope,12/5/2013 16:00,JourneyOptimist,Twitter, #Hope #NewBeginnings,18,35,Canada,2013,12,5,16
127,Empowermentthroughlearningandpersonalgrowth.,Empowerment,7/20/2014 11:30,GrowthSeeker,Instagram, #Empowerment #PersonalGrowth,25,50,USA,2014,7,20,11
128,Compassiontowardsthoseinneedduringtheholidays.,Compassion,12/22/2015 14:20,HolidayHelper,Facebook, #Compassion #HolidaySupport,18,35,USA,2015,12,22,14
129,Tendernessinthewarmthofacozywinterevening.,Tenderness,2/10/2016 19:45,WinterWarmth,Twitter, #Tenderness #CozyEvening,25,50,UK,2016,2,10,19
130,Arousalofexcitementforanupcomingadventure.,Arousal,4/30/2017 11:30,AdventureAwaits,Instagram, #Arousal #AdventureTime,20,40,Australia,2017,4,30,11
131,Enthusiasmforacreativeprojectinthemaking.,Enthusiasm,9/15/2018 16:00,CreativeSpirit,Facebook, #Enthusiasm #Creativity,15,30,Canada,2018,9,15,16
132,Fulfillmentincompletingachallengingworkoutroutine.,Fulfillment,6/28/2019 18:20,FitnessAchiever,Twitter, #Fulfillment #FitnessGoals,22,45,India,2019,6,28,18
133,Reverencefortheartistrydisplayedinamuseum.,Reverence,11/11/2020 15:00,ArtAppreciator,Instagram, #Reverence #ArtAppreciation,18,35,UK,2020,11,11,15
134,Elationafterachievingapersonalgoal.,Elation,3/2/2021 9:30,GoalAchiever2,Facebook, #Elation #PersonalAchievement,25,50,USA,2021,3,2,9
135,Elationoverdiscoveringahiddengeminthecity.,Elation,2/18/2012 14:30,UrbanExplorer2,Twitter, #Elation #HiddenGem,20,40,USA,2012,2,18,14
136,Theeuphoriaofasurprisebirthdaycelebration.,Euphoria,11/5/2018 21:45,BirthdayJoy,Instagram, #Euphoria #BirthdaySurprise,15,30,UK,2018,11,5,21
137,Contentmentinthesimplicityofahome-cookedmeal.,Contentment,9/12/2015 13:20,HomeChef,Facebook, #Contentment #HomeCooking,25,50,India,2015,9,12,13
138,Serenityfoundinthemelodyofapeacefulpiano.,Serenity,7/30/2016 18:10,MusicLover4,Twitter, #Serenity #PeacefulMelody,18,35,Canada,2016,7,30,18
139,Gratitudeforthesupportivecommunityaroundme.,Gratitude,4/20/2013 10:30,CommunityLove,Instagram, #Gratitude #CommunitySupport,30,60,USA,2013,4,20,10
140,Hopefulabouttheprospectsofanewbusinessventure.,Hope,12/8/2017 19:15,EntrepreneurHope,Facebook, #Hope #BusinessVenture,22,45,Canada,2017,12,8,19
141,Empowermentthroughmentoringandguidingothers.,Empowerment,6/3/2014 8:20,MentorEmpower,Twitter, #Empowerment #Mentorship,15,30,UK,2014,6,3,8
142,Compassionshownthroughactsofkindnessinthecommunity.,Compassion,1/15/2019 14:50,KindnessInAction,Instagram, #Compassion #CommunityKindness,18,35,Australia,2019,1,15,14
143,Tendernessinaheartfeltmessagetoalovedone.,Tenderness,12/25/2016 19:30,LoveExpress,Facebook, #Tenderness #LoveNote,25,50,UK,2016,12,25,19
144,Arousalofexcitementbeforeamuch-awaitedtrip.,Arousal,3/10/2018 9:45,TravelExcitement,Twitter, #Arousal #TravelAdventure,20,40,India,2018,3,10,9
145,Enthusiasmforanewartisticprojectintheworks.,Enthusiasm,9/17/2020 16:30,ArtisticSpirit,Instagram, #Enthusiasm #ArtisticProject,15,30,USA,2020,9,17,16
146,Feelingasenseoffulfillmentafterhelpingothers.,Fulfillment,8/28/2011 18:45,HelperHeart,Facebook, #Fulfillment #HelpingOthers,22,45,Canada,2011,8,28,18
147,Reverenceforthehistoricalsignificanceofalandmark.,Reverence,11/1/2017 15:30,HistoryBuff,Twitter, #Reverence #HistoricalSite,18,35,Australia,2017,11,1,15
148,Elationafterachievingafitnessmilestone.,Elation,6/15/2019 10:00,FitnessAchiever2,Instagram, #Elation #FitnessMilestone,25,50,UK,2019,6,15,10
149,Theeuphoriaofasuccessfulproductlaunch.,Euphoria,4/3/2022 11:45,ProductLaunchJoy,Facebook, #Euphoria #ProductLaunchSuccess,15,30,USA,2022,4,3,11
150,Contentmentintheembraceofalovedone.,Contentment,11/12/2010 20:20,LovingEmbrace,Twitter, #Contentment #Love,30,60,India,2010,11,12,20
151,Serenityfoundinthebeautyofasunsetbythesea.,Serenity,7/22/2011 18:30,SunsetWatcher2,Instagram, #Serenity #SunsetViews,22,45,Canada,2011,7,22,18
152,Gratitudeforthesmalljoysthateachdaybrings.,Gratitude,3/30/2012 11:20,JoyfulHeart2,Facebook, #Gratitude #SmallJoys,15,30,Australia,2012,3,30,11
153,Hopefulaboutthepotentialforpersonalgrowth.,Hope,10/5/2013 16:40,GrowthOptimist,Twitter, #Hope #PersonalDevelopment,18,35,UK,2013,10,5,16
154,Empowermentthroughlearninganewskill.,Empowerment,7/10/2014 13:15,SkillEmpower,Instagram, #Empowerment #SkillBuilding,25,50,India,2014,7,10,13
155,Compassioninvolunteeringforalocalcharity.,Compassion,12/18/2015 14:20,CharityVolunteer,Facebook, #Compassion #VolunteerWork,18,35,USA,2015,12,18,14
156,Tendernessinaquietmomentsharedwithapet.,Tenderness,2/10/2016 19:45,PetLove,Twitter, #Tenderness #PetLove,25,50,Canada,2016,2,10,19
157,Arousalofexcitementforanupcomingfestival.,Arousal,9/25/2017 11:30,FestivalFan,Instagram, #Arousal #FestivalExcitement,20,40,UK,2017,9,25,11
158,EnthusiasmforaDIYhomeimprovementproject.,Enthusiasm,4/15/2018 16:00,DIYEnthusiast,Facebook, #Enthusiasm #HomeImprovement,15,30,Australia,2018,4,15,16
159,Fulfillmentincompletingachallengingpuzzle.,Fulfillment,11/28/2019 18:20,PuzzleMaster,Twitter, #Fulfillment #PuzzleChallenge,22,45,India,2019,11,28,18
160,Reverenceforthewondersofnatureonahikingtrail.,Reverence,5/11/2020 15:00,NatureAdmirer,Instagram, #Reverence #NatureExploration,18,35,USA,2020,5,11,15
161,Elationafterasurprisereunionwithachildhoodfriend.,Elation,2/5/2021 9:30,ChildhoodJoy,Facebook, #Elation #FriendshipReunion,25,50,Canada,2021,2,5,9
162,Sufferingfromdespairafteranothersetback.,Despair,3/10/2021 8:30,StrugglingSoul,Twitter, #Despair #Struggle,5,10,USA,2021,3,10,8
163,"Overwhelmedbygrief,missingalovedonedearly.",Grief,7/5/2022 15:45,MourningHeart,Instagram, #Grief #Loss,8,15,Canada,2022,7,5,15
164,Lonelinesscreepsinasthenightgrowscolder.,Loneliness,11/18/2019 21:20,SolitarySoul,Facebook, #Loneliness #Isolation,10,20,UK,2019,11,18,21
165,JealousyconsumesmeasIwitnessothers'success.,Jealousy,8/12/2020 11:30,EnviousObserver,Twitter, #Jealousy #Envy,12,25,India,2020,8,12,11
166,Resentmentbuildingupoverpastbetrayals.,Resentment,5/22/2018 14:45,BitterHeart,Instagram, #Resentment #Bitterness,7,15,Australia,2018,5,22,14
167,Frustrationmountsasobstaclesblockmypath.,Frustration,1/30/2017 16:10,BlockedGoals,Facebook, #Frustration #Obstacles,10,20,USA,2017,1,30,16
168,"Boredomsetsin,thedayfeelsendlesslydull.",Boredom,9/28/2016 19:45,BoredMind,Twitter, #Boredom #LackOfInterest,8,15,Canada,2016,9,28,19
169,"Anxietygripsmyheart,worrycloudsmythoughts.",Anxiety,4/15/2019 9:00,WorriedMind,Instagram, #Anxiety #Worry,12,25,UK,2019,4,15,9
170,Intimidationbytheunknownfutureahead.,Intimidation,12/3/2021 18:30,FearfulSoul,Facebook, #Intimidation #Fear,15,30,India,2021,12,3,18
171,Helplessnesssinksinaschallengespileup.,Helplessness,6/20/2020 14:20,OverwhelmedHeart,Twitter, #Helplessness #Overwhelmed,8,15,Australia,2020,6,20,14
172,EnvyeatsawayatmeasIseeothers'prosperity.,Envy,11/7/2018 11:30,CovetousMind,Instagram, #Envy #Desire,10,20,Canada,2018,11,7,11
173,Regretovermissedopportunitieshauntsmythoughts.,Regret,8/25/2017 16:00,RemorsefulSoul,Facebook, #Regret #MissedChances,12,25,UK,2017,8,25,16
174,Disgustatthesightofinjusticeandcruelty.,Disgust,2/11/2019 9:45,DisgustedHeart,Twitter, #Disgust #Injustice,7,15,India,2019,2,11,9
175,"Drowningindespair,hopeslippingthroughmyfingers.",Despair,4/2/2016 20:20,HopelessHeart,Instagram, #Despair #Hopeless,10,20,USA,2016,4,2,20
176,"Griefweighsheavy,tearsaconstantcompanion.",Grief,10/18/2015 15:30,TearfulSoul,Facebook, #Grief #Tears,12,25,Canada,2015,10,18,15
177,"Lonelinessinacrowdedroom,asilentcryforconnection.",Loneliness,7/12/2019 18:10,IsolatedMind,Twitter, #Loneliness #SeekingConnection,15,30,UK,2019,7,12,18
178,"Jealousygnawsatmyconfidence,atoxicemotion.",Jealousy,6/3/2018 16:30,SelfDoubt,Instagram, #Jealousy #Insecurity,8,15,India,2018,6,3,16
179,"Resentmentfesters,poisoningrelationships.",Resentment,1/15/2022 12:00,BrokenTrust,Facebook, #Resentment #BrokenTrust,10,20,Australia,2022,1,15,12
180,"Frustrationboilsover,avolcaniceruptionofemotions.",Frustration,4/10/2017 14:45,ExplosiveMind,Twitter, #Frustration #EmotionalOutburst,12,25,USA,2017,4,10,14
181,"Boredomsettleslikedust,lifefeelsmundane.",Boredom,11/28/2016 19:00,MundaneHeart,Instagram, #Boredom #Monotony,7,15,Canada,2016,11,28,19
182,"Anxietygripsmychest,arelentlessgriponmythoughts.",Anxiety,9/5/2018 9:30,RestlessMind,Facebook, #Anxiety #Restlessness,10,20,UK,2018,9,5,9
183,"Intimidationbythechallengesahead,feartakeshold.",Intimidation,10/22/2021 18:30,FearfulJourney,Twitter, #Intimidation #FacingFear,15,30,India,2021,10,22,18
184,"Helplessnessengulfsme,drowninginaseaofproblems.",Helplessness,5/8/2019 14:20,OverwhelmedSoul,Instagram, #Helplessness #Struggling,8,15,Australia,2019,5,8,14
185,"Envypoisonsmythoughts,covetingothers'success.",Envy,3/20/2017 11:30,GreenEyedMonster,Facebook, #Envy #Success,10,20,Canada,2017,3,20,11
186,Regretfordecisionsthatledtoapainfulpresent.,Regret,12/15/2018 16:00,RegretfulMind,Twitter, #Regret #PastChoices,12,25,USA,2018,12,15,16
187,Disgustatthecorruptionthatstainssociety.,Disgust,7/1/2016 9:45,CorruptedHeart,Instagram, #Disgust #Corruption,7,15,UK,2016,7,1,9
188,"Sinkingindespair,eachdaydarkerthanthelast.",Despair,8/20/2020 20:20,DrowningSoul,Facebook, #Despair #DarkDays,10,20,India,2020,8,20,20
189,"Griefoverwhelms,astormofemotionswithin.",Grief,2/25/2021 15:30,StormyHeart,Twitter, #Grief #EmotionalStorm,12,25,Canada,2021,2,25,15
190,"Lonelinessechoesinemptyspaces,yearningforconnection.",Loneliness,9/12/2019 18:10,EchoingSoul,Instagram, #Loneliness #YearningForConnection,15,30,Australia,2019,9,12,18
191,"Jealousypoisonsmythoughts,resentmentbrewingwithin.",Jealousy,8/5/2018 16:30,PoisonedMind,Facebook, #Jealousy #Resentment,8,15,USA,2018,8,5,16
192,"Resentmentfesters,awoundthatrefusestoheal.",Resentment,1/12/2017 12:00,UnforgivingSoul,Twitter, #Resentment #Unforgiving,10,20,India,2017,1,12,12
193,"Frustrationescalates,athunderstormofemotions.",Frustration,4/5/2022 14:45,ThunderingMind,Instagram, #Frustration #EmotionalOutburst,12,25,UK,2022,4,5,14
194,"Boredomlingers,astagnantpoolofindifference.",Boredom,10/2/2021 19:00,StagnantHeart,Facebook, #Boredom #Stagnation,7,15,Canada,2021,10,2,19
195,"Embarkingonajourneyofdiscovery,fueledbycuriosityandathirstforknowledge.",Curiosity,4/15/2023 10:15,InquisitiveMind,Twitter, #Curiosity #Learning,15,30,USA,2023,4,15,10
196,"Lostinthevastseaofinformation,anindifferentwaveinthedigitalocean.",Indifference,11/28/2022 17:30,ApatheticObserver,Instagram, #Indifference #DigitalOverload,7,15,Canada,2022,11,28,17
197,"Thecomplexpuzzleoflifeleavesmeinastateofperpetualconfusion,seekinganswersinthechaos.",Confusion,4/2/2020 9:45,SeekingClarity,Facebook, #Confusion #LifePuzzle,10,20,UK,2020,4,2,9
198,"Anumbnesssettlesoverme,ashieldagainsttheoverwhelmingemotionslifethrowsmyway.",Numbness,8/10/2021 14:00,EmotionallyDistant,Twitter, #Numbness #EmotionalShield,8,15,India,2021,8,10,14
199,"Gazingatthesunset,amelancholiclongingformomentsthatslipthroughthefingersoftime.",Melancholy,6/18/2019 20:45,SunsetDreamer,Instagram, #Melancholy #SunsetMoments,12,25,Australia,2019,6,18,20
200,"Revisitingoldphotographs,caughtintheembraceofnostalgia'sbittersweetsymphony.",Nostalgia,2/5/2018 15:15,MemoryLaneTraveler,Facebook, #Nostalgia #MemoryLane,10,20,USA,2018,2,5,15
201,"Tornbetweenconflictingemotions,anambivalencethatpaintsmydecisionsinshadesofuncertainty.",Ambivalence,5/30/2022 11:30,MixedFeelings,Twitter, #Ambivalence #UncertainChoices,12,25,Canada,2022,5,30,11
202,"Embracingtheebbandflowoflife,findingacceptanceinthedanceofexistence.",Acceptance,1/10/2023 16:20,ZenLifestyle,Instagram, #Acceptance #LifeJourney,15,30,UK,2023,1,10,16
203,"Facingchallengeshead-on,adeterminationthatfuelsthefirewithintoachievetheimpossible.",Determination,9/18/2020 13:45,ResilientSpirit,Facebook, #Determination #AchieveTheImpossible,10,20,India,2020,9,18,13
204,"Serenityfoundinthestillnessofnature,atranquilretreatfromthechaosofthemodernworld.",Serenity,7/3/2021 19:00,NatureSoul,Twitter, #Serenity #NatureRetreat,12,25,Australia,2021,7,3,19
205,"Curiosityleadingmedowntherabbitholeofknowledge,aperpetualstudentinlife'sclassroom.",Curiosity,10/8/2022 8:15,EternalLearner,Instagram, #Curiosity #KnowledgeQuest,20,40,USA,2022,10,8,8
206,"Floatingthroughthedaywithanairofindifference,detachedfromthemundanehappeningsaround.",Indifference,3/22/2023 16:30,AloofObserver,Facebook, #Indifference #FloatingThroughLife,10,20,Canada,2023,3,22,16
207,"Entangledinthewebofthoughts,confusionreigningasInavigatethelabyrinthofideas.",Confusion,5/15/2021 11:45,ThoughtExplorer,Twitter, #Confusion #ThoughtLabyrinth,15,30,UK,2021,5,15,11
208,"Numbtothechaos,emotionslockedaway,astoicfacadeconcealingtheinnerturmoil.",Numbness,12/28/2019 14:30,StoicSoul,Instagram, #Numbness #StoicFacade,8,15,Australia,2019,12,28,14
209,"Melancholywhispersinthebreeze,asilentconversationwiththeechoesofforgottendreams.",Melancholy,3/1/2020 19:00,DreamerInSilence,Facebook, #Melancholy #WhispersInTheBreeze,12,25,India,2020,3,1,19
210,"Stumblinguponanoldjournal,nostalgiafloodinginwaves,carryingmetomomentslonggone.",Nostalgia,7/10/2018 15:45,JournalKeeper,Twitter, #Nostalgia #JournalMoments,10,20,Canada,2018,7,10,15
211,"Atapestryofconflictingfeelings,weavingthroughuncertainty,caughtinthethreadsofambivalence.",Ambivalence,1/5/2022 10:30,ThreadWeaver,Instagram, #Ambivalence #ConflictingFeelings,12,25,UK,2022,1,5,10
212,"Embracingtheflaws,findingacceptanceinimperfection,ajourneytowardsself-love.",Acceptance,8/20/2021 16:20,SelfLoveAdvocate,Facebook, #Acceptance #SelfLoveJourney,15,30,Australia,2021,8,20,16
213,"Determinationburninglikeawildfire,overcomingobstacles,turningdreamsintoreality.",Determination,11/3/2019 13:45,DreamChaser,Twitter, #Determination #DreamsIntoReality,18,35,USA,2019,11,3,13
214,"Tranquilmomentsbytheocean,serenitywashingover,apeacefulretreatwithinthewaves'embrace.",Serenity,4/12/2020 19:30,OceanSoul,Instagram, #Serenity #OceanRetreat,25,50,Canada,2020,4,12,19
215,"Exploringnewhorizonswiththesparkofcuriosity,anadventurerinthevastlandscapeofknowledge.",Curiosity,4/15/2022 8:45,HorizonExplorer,Facebook, #Curiosity #NewHorizons,22,45,India,2022,4,15,8
216,"Driftingthroughthedaywithanonchalantdemeanor,embracingtheartofindifference.",Indifference,2/10/2023 17:00,NonchalantSpirit,Twitter, #Indifference #DriftingThroughLife,9,18,UK,2023,2,10,17
217,"Wrestlingwiththoughts,aperplexedmindlostinthelabyrinthoflife'scomplexities.",Confusion,8/5/2020 12:15,ComplexThinker,Instagram, #Confusion #PerplexedMind,14,28,Australia,2020,8,5,12
218,"Immersedinastateofemotionalnumbness,ashieldagainstthestormofdailystruggles.",Numbness,12/1/2021 15:30,ShieldedHeart,Facebook, #Numbness #EmotionalShield,10,20,USA,2021,12,1,15
219,"Amelancholicsymphonyplayinginthebackground,thesoundtrackofawistfulheart.",Melancholy,3/25/2019 21:00,SymphonySoul,Twitter, #Melancholy #WistfulHeart,13,26,Canada,2019,3,25,21
220,"Flippingthroughthepagesofanoldyearbook,nostalgiapaintingsmilesandtearsonmyface.",Nostalgia,6/18/2017 14:45,YearbookExplorer,Instagram, #Nostalgia #YearbookMemories,12,25,India,2017,6,18,14
221,"Tornbetweenopposingemotions,anambivalencethatcolorsmydecisionswithshadesofuncertainty.",Ambivalence,7/8/2022 11:30,DecisiveDilemma,Facebook, #Ambivalence #ShadesOfUncertainty,15,30,Australia,2022,7,8,11
222,"Embracinglife'simperfections,findingacceptanceinthejourney,scarsandall.",Acceptance,5/15/2023 16:20,ImperfectHarmony,Twitter, #Acceptance #ImperfectJourney,18,36,Canada,2023,5,15,16
223,"Afierydeterminationburningwithin,fueledbythevisionofreachingunparalleledheights.",Determination,9/10/2021 14:45,VisionarySpirit,Instagram, #Determination #UnparalleledHeights,20,40,UK,2021,9,10,14
224,"Baskingintheserenityofaquietforest,wherethewhispersofnaturebringpeacetothesoul.",Serenity,2/28/2020 18:30,ForestDreamer,Facebook, #Serenity #NatureWhispers,25,50,USA,2020,2,28,18
225,"Indifferenttothenoiseoftheworld,asilentobserverinthemidstoflife'scacophony.",Indifference,3/10/2023 16:30,SilentSpectator,Instagram, #Indifference #SilentObserver,9,18,India,2023,3,10,16
226,"Navigatingthroughthelabyrinthofthoughts,confusionaconstantcompanioninthemazeofideas.",Confusion,5/2/2021 11:45,MazeNavigator,Facebook, #Confusion #ThoughtLabyrinth,14,28,Australia,2021,5,2,11
227,"Animpenetrablenumbnessshieldsmefromtheemotionalstorms,afortressofstoicresilience.",Numbness,10/18/2019 14:30,ResilientFortress,Twitter, #Numbness #StoicResilience,11,22,UK,2019,10,18,14
228,"Melancholypaintingtheworldinhuesofnostalgia,acanvasofbittersweetmemories.",Melancholy,1/5/2020 20:00,CanvasDreamer,Instagram, #Melancholy #BittersweetMemories,13,26,USA,2020,1,5,20
229,"Ajourneyintothepast,flippingthroughthepagesofanolddiary,nostalgiatakingthelead.",Nostalgia,8/10/2018 15:45,DiaryExplorer,Facebook, #Nostalgia #DiaryJourney,12,25,Canada,2018,8,10,15
230,"Ambivalencecloudingdecisions,caughtinthecrossroadsofconflictingemotions.",Ambivalence,1/15/2022 10:30,CrossroadsTraveler,Twitter, #Ambivalence #ConflictingEmotions,15,30,India,2022,1,15,10
231,"Embracingimperfections,findingacceptanceinthemosaicoflife'sbeautifulchaos.",Acceptance,7/20/2021 16:20,MosaicDreamer,Instagram, #Acceptance #BeautifulChaos,18,36,Australia,2021,7,20,16
232,"Determinationasthedrivingforce,propellingmeforwardonthepathtoextraordinaryachievements.",Determination,12/3/2019 13:45,PathfinderSpirit,Facebook, #Determination #ExtraordinaryPath,20,40,USA,2019,12,3,13
233,"Seekingserenityinthemelodyofraindrops,atranquilescapefromthenoiseofeverydaylife.",Serenity,4/12/2020 19:30,RaindropHarmony,Twitter, #Serenity #RaindropMelody,25,50,Canada,2020,4,12,19
234,"Curiositydrivingtheexplorationoftheunknown,aseekerofknowledgeinunchartedterritories.",Curiosity,5/8/2022 8:45,SeekerOfUnknowns,Instagram, #Curiosity #SeekerOfKnowledge,22,45,UK,2022,5,8,8
235,"Driftingthroughthedaywithanairofnonchalance,indifferenttothetrivialitiesoflife.",Indifference,2/22/2023 17:00,NonchalantWanderer,Facebook, #Indifference #DriftingThroughLife,9,18,India,2023,2,22,17
236,"Lostinthelabyrinthofthoughts,confusioncastingshadowsonthequestforclarity.",Confusion,6/5/2020 12:15,ShadowedSeeker,Twitter, #Confusion #LabyrinthOfThoughts,14,28,Australia,2020,6,5,12
237,"Wrappedinthecloakofemotionalnumbness,ashieldagainstthestormsoflife'sturbulence.",Numbness,11/30/2021 15:30,TurbulentShield,Instagram, #Numbness #EmotionalStorms,10,20,Canada,2021,11,30,15
238,"Melancholyasacompanion,paintingthecanvasoflifewiththebrushstrokesofwistfulyearning.",Melancholy,2/25/2019 21:00,WistfulPainter,Facebook, #Melancholy #WistfulYearning,13,26,UK,2019,2,25,21
239,"Leafingthroughthepagesofanoldphotoalbum,nostalgiaweavingtalesoflaughterandtears.",Nostalgia,5/18/2017 14:45,TaleWeaver,Twitter, #Nostalgia #PhotoAlbumStories,12,25,USA,2017,5,18,14
240,"Ambivalenceintheair,caughtbetweenthecrossroadsofconflictingemotionsanddecisions.",Ambivalence,8/5/2022 11:30,CrossroadsExplorer,Instagram, #Ambivalence #CrossroadsConfusion,15,30,Canada,2022,8,5,11
241,"Embracingthebeautyinimperfections,findingacceptanceinthemosaicoflife'sunpredictableart.",Acceptance,6/15/2023 16:20,MosaicArtist,Facebook, #Acceptance #UnpredictableArt,18,36,Australia,2023,6,15,16
242,"Determinationablaze,forgingapaththroughchallenges,sculptingdreamsintotangiblerealities.",Determination,10/10/2021 14:45,DreamSculptor,Twitter, #Determination #SculptingDreams,20,40,UK,2021,10,10,14
243,"Immerseintheserenityofamoonlitnight,wherethequietwhispersofnaturebringpeacetothesoul.",Serenity,5/12/2020 19:30,MoonlitSoul,Instagram, #Serenity #MoonlitPeace,25,50,USA,2020,5,12,19
244,"Fueledbycuriosity,venturingintounchartedrealms,afearlessexplorerofthemysteriesoftheworld.",Curiosity,12/1/2022 9:15,FearlessExplorer,Facebook, #Curiosity #FearlessExplorer,22,44,India,2022,12,1,9
245,"Wrappedinthecloakofemotionalnumbness,ashieldagainstthestormsoflife'sturbulence.",Numbness,11/30/2021 15:30,TurbulentShield,Instagram, #Numbness #EmotionalStorms,10,20,Canada,2021,11,30,15
246,"Dancingthroughlifewiththeexuberanceofacarefreespirit,embracingjoyandzestateveryturn.",Zest,7/12/2018 17:45,JoyfulDancer,Twitter, #Zest #CarefreeSpirit,15,30,USA,2018,7,12,17
247,"Baskinginthegoldenglowofcontentment,asereneriverflowingthroughthelandscapeoftheheart.",Contentment,9/5/2020 20:10,SereneBasker,Facebook, #Contentment #GoldenGlow,18,36,Australia,2020,9,5,20
248,"Gazingtowardsthehorizonwithhopefuleyes,paintingacanvasofdreamsilluminatedbythesunofoptimism.",Hopeful,4/18/2022 8:00,DreamPainter,Instagram, #Hopeful #CanvasOfDreams,12,24,India,2022,4,18,8
249,"Standingtall,proudasanoak,thebranchesofachievementreachingtowardstheskyofaccomplishment.",Proud,12/10/2019 12:20,OakAchiever,Twitter, #Proud #BranchesOfAchievement,25,50,Canada,2019,12,10,12
250,"Aheartoverflowingwithgratitude,agardenwhereappreciationbloomsinthesoilofkindnessandconnection.",Grateful,2/28/2023 9:45,HeartGardener,Facebook, #Grateful #BlossomingConnection,20,40,USA,2023,2,28,9
251,"Extendingahand,empatheticthreadsweavingatapestryofunderstanding,embracingthejoysandsorrowsofothers.",Empathetic,4/3/2018 14:15,ThreadWeaver,Instagram, #Empathetic #TapestryOfUnderstanding,15,30,UK,2018,4,3,14
252,"Compassionateclouds,heavywithcare,showeringempathyontheparchedgroundsofhumansuffering.",Compassionate,6/20/2022 10:30,CloudCaretaker,Twitter, #Compassionate #ShowerOfEmpathy,18,36,Australia,2022,6,20,10
253,"Playfullydancingintherainoflaughter,awhimsicalspirittwirlinginthepuddlesofjoyandlightheartedness.",Playful,7/8/2020 18:00,RainDancer,Facebook, #Playful #DanceInTheRain,22,44,Canada,2020,7,8,18
254,"Soaringonthewingsofafreespirit,unburdenedbythechainsofconformity,paintingtheskywithindependence.",Free-spirited,8/15/2021 11:10,SkyPainter,Instagram, #FreeSpirit #PaintingTheSky,20,40,India,2021,8,15,11
255,"Bathedintheglowofinspiration,acreativephoenixrisingfromtheashesofordinarythoughtstoexplorenewrealms.",Inspired,10/25/2019 16:50,PhoenixExplorer,Twitter, #Inspired #CreativePhoenix,15,30,UK,2019,10,25,16
256,"Navigatingtheseaofhope,sailingtowardsthesunriseofpossibilities,confidentintheshipofpositiveanticipation.",Hopeful,10/5/2023 7:30,SunriseNavigator,Facebook, #Hopeful #SunriseOfPossibilities,12,24,USA,2023,10,5,7
257,"Stridingwithconfidence,footprintsofself-assurednessimprintedonthesandsofchallengesconqueredandvictoriesclaimed.",Confident,2/15/2022 13:15,SandStrider,Instagram, #Confident #FootprintsOfAssuredness,25,50,Australia,2022,2,15,13
258,"Lostinthesymphonyofthenight,amoonlitserenadethatwhisperstalesofwanderlustandmoonlitdreams.",Serenity,5/8/2021 22:00,NightSerenader,Twitter, #Serenity #MoonlitSerenade,13,26,Canada,2021,5,8,22
259,"Unveilingthelayersofcuriosity,alabyrinthofquestionsleadingtothetreasuretrovesofundiscoveredknowledge.",Curiosity,11/29/2020 14:45,KnowledgeSeeker,Instagram, #Curiosity #LabyrinthOfQuestions,17,34,USA,2020,11,29,14
260,"Intheembraceoftheautumnbreeze,leavesofambivalencedancinginawaltzbetweenchoicesanduncertainties.",Ambivalence,9/14/2019 10:20,BreezeWaltzer,Facebook, #Ambivalence #AutumnWaltz,14,28,UK,2019,9,14,10
261,"Gratitudeasaguidingstar,navigatingtheconstellationofblessingsinthevastuniverseoflife'spreciousmoments.",Grateful,3/12/2022 19:55,StarNavigator,Twitter, #Grateful #GuidingStar,19,38,Australia,2022,3,12,19
262,"Withazestfulheart,sprintingthroughfieldsofenthusiasm,chasingsunbeamsandlaughterinthemeadowsofjoy.",Zest,3/30/2023 16:30,MeadowSprinter,Instagram, #Zest #FieldsOfEnthusiasm,16,32,India,2023,3,30,16
263,"Acompassionaterain,tearsofempathyfallinggently,nurturingtheseedsofkindnessinthegardenofhumanconnections.",Compassionate,7/1/2021 12:10,RainNurturer,Facebook, #Compassionate #TearsOfEmpathy,21,42,Canada,2021,7,1,12
264,"Proudlyscalingthepeaksofachievement,amountaineerconqueringchallengesandplantingtheflagofsuccess.",Proud,1/5/2020 8:45,PeakConqueror,Twitter, #Proud #ScalingPeaks,23,46,USA,2020,1,5,8
265,"Embracedbythehopefuldawn,agardenersowingseedsofoptimism,tendingtothebloomsofabrightertomorrow.",Hopeful,7/17/2022 6:15,DawnGardener,Instagram, #Hopeful #SeedsOfOptimism,14,28,UK,2022,7,17,6
266,"Aplayfulescapadeinthecarnivaloflife,carousellaughterandcottoncandydreamsswirlinginthejoyousatmosphere.",Playful,8/22/2018 17:20,CarnivalDreamer,Facebook, #Playful #CarnivalEscapade,24,48,Australia,2018,8,22,17
267,"Floatingoncloudsofinspiration,anartistpaintingtheskywithstrokesofcreativity,creatingamasterpieceofdreams.",Inspired,12/8/2021 14:30,SkyArtist,Twitter, #Inspired #CloudsOfCreativity,18,36,India,2021,12,8,14
268,"Navigatingtheriverofcontentment,asereneboatcruisethroughthetranquilwatersofinnerpeaceandacceptance.",Contentment,4/27/2019 9:50,RiverNavigator,Instagram, #Contentment #TranquilWaters,20,40,Canada,2019,4,27,9
269,"Withempathyasalantern,wanderingthroughthedarkalleysofsorrow,illuminatingthepathwithcompassionandcare.",Empathetic,9/3/2023 21:40,LanternWanderer,Facebook, #Empathetic #LanternOfCompassion,16,32,USA,2023,9,3,21
270,"Afreespiritsoaringonthewingsofdreams,leavingtrailsofindependenceintheazureskyofboundlesspossibilities.",Free-spirited,6/10/2020 10:05,DreamSoarer,Twitter, #FreeSpirit #WingsOfDreams,22,44,UK,2020,6,10,10
271,"Bathedinthegoldenhuesofgratefulness,asunsetofappreciationcastingitswarmglowonthelandscapesoftheheart.",Grateful,4/1/2022 18:30,SunsetAdmirer,Instagram, #Grateful #GoldenHues,19,38,Australia,2022,4,1,18
272,"Confidentstridesinthedanceoflife,aballroomwhereself-assurednessleads,twirlingthroughchallengeswithgrace.",Confident,1/15/2021 13:00,DanceStrider,Facebook, #Confident #DanceOfLife,23,46,Canada,2021,1,15,13
273,"Hopefulwhispersofwind,carryingthepromisesofabrightertomorrow,asymphonyofoptimismintheairofpossibilities.",Hopeful,5/6/2023 7:20,WindWhisperer,Twitter, #Hopeful #BrighterTomorrows,15,30,India,2023,5,6,7
274,"Playfullyjugglingresponsibilities,acircusperformerbalancingtheactsofworkandjoy,tossinglaughterintotheair.",Playful,11/18/2019 15:15,JugglingArtist,Instagram, #Playful #JugglingResponsibilities,25,50,USA,2019,11,18,15
275,"Whisperingtalesofinspirationtothestars,astorytellercraftingconstellationsfromthethreadsofimagination.",Inspired,8/29/2020 20:45,StarStoryteller,Facebook, #Inspired #TalesToTheStars,14,28,UK,2020,8,29,20
276,"Chartingacoursethroughthewavesofhopefulanticipation,asailorsteeringtowardstheshoresofdreamsyetunexplored.",Hopeful,10/30/2022 11:40,WaveNavigator,Twitter, #Hopeful #SailorOfDreams,17,34,Australia,2022,10,30,11
277,"Acompassionaterain,tearsofempathyfallinggently,nurturingtheseedsofkindnessinthegardenofhumanconnections.",Compassionate,7/1/2021 12:10,RainNurturer,Instagram, #Compassionate #TearsOfEmpathy,21,42,Canada,2021,7,1,12
278,"Proudlyscalingthepeaksofachievement,amountaineerconqueringchallengesandplantingtheflagofsuccess.",Proud,1/5/2020 8:45,PeakConqueror,Twitter, #Proud #ScalingPeaks,23,46,USA,2020,1,5,8
279,"Embracedbythehopefuldawn,agardenersowingseedsofoptimism,tendingtothebloomsofabrightertomorrow.",Hopeful,7/17/2022 6:15,DawnGardener,Instagram, #Hopeful #SeedsOfOptimism,14,28,UK,2022,7,17,6
280,"Aplayfulescapadeinthecarnivaloflife,carousellaughterandcottoncandydreamsswirlinginthejoyousatmosphere.",Playful,8/22/2018 17:20,CarnivalDreamer,Facebook, #Playful #CarnivalEscapade,24,48,Australia,2018,8,22,17
281,"Floatingoncloudsofinspiration,anartistpaintingtheskywithstrokesofcreativity,creatingamasterpieceofdreams.",Inspired,12/8/2021 14:30,SkyArtist,Twitter, #Inspired #CloudsOfCreativity,18,36,India,2021,12,8,14
282,"Navigatingtheriverofcontentment,asereneboatcruisethroughthetranquilwatersofinnerpeaceandacceptance.",Contentment,4/27/2019 9:50,RiverNavigator,Instagram, #Contentment #TranquilWaters,20,40,Canada,2019,4,27,9
283,"Withempathyasalantern,wanderingthroughthedarkalleysofsorrow,illuminatingthepathwithcompassionandcare.",Empathetic,9/3/2023 21:40,LanternWanderer,Facebook, #Empathetic #LanternOfCompassion,16,32,USA,2023,9,3,21
284,"Afreespiritsoaringonthewingsofdreams,leavingtrailsofindependenceintheazureskyofboundlesspossibilities.",Free-spirited,6/10/2020 10:05,DreamSoarer,Twitter, #FreeSpirit #WingsOfDreams,22,44,UK,2020,6,10,10
285,"Bathedinthegoldenhuesofgratefulness,asunsetofappreciationcastingitswarmglowonthelandscapesoftheheart.",Grateful,4/1/2022 18:30,SunsetAdmirer,Instagram, #Grateful #GoldenHues,19,38,Australia,2022,4,1,18
286,"Confidentstridesinthedanceoflife,aballroomwhereself-assurednessleads,twirlingthroughchallengeswithgrace.",Confident,1/15/2021 13:00,DanceStrider,Facebook, #Confident #DanceOfLife,23,46,Canada,2021,1,15,13
287,"Hopefulwhispersofwind,carryingthepromisesofabrightertomorrow,asymphonyofoptimismintheairofpossibilities.",Hopeful,5/6/2023 7:20,WindWhisperer,Twitter, #Hopeful #BrighterTomorrows,15,30,India,2023,5,6,7
288,"Playfullyjugglingresponsibilities,acircusperformerbalancingtheactsofworkandjoy,tossinglaughterintotheair.",Playful,11/18/2019 15:15,JugglingArtist,Instagram, #Playful #JugglingResponsibilities,25,50,USA,2019,11,18,15
289,"Whisperingtalesofinspirationtothestars,astorytellercraftingconstellationsfromthethreadsofimagination.",Inspired,8/29/2020 20:45,StarStoryteller,Facebook, #Inspired #TalesToTheStars,14,28,UK,2020,8,29,20
290,"Chartingacoursethroughthewavesofhopefulanticipation,asailorsteeringtowardstheshoresofdreamsyetunexplored.",Hopeful,10/30/2022 11:40,WaveNavigator,Twitter, #Hopeful #SailorOfDreams,17,34,Australia,2022,10,30,11
291,"Acompassionaterain,tearsofempathyfallinggently,nurturingtheseedsofkindnessinthegardenofhumanconnections.",Compassionate,7/1/2021 12:10,RainNurturer,Instagram, #Compassionate #TearsOfEmpathy,21,42,Canada,2021,7,1,12
292,"Proudlyscalingthepeaksofachievement,amountaineerconqueringchallengesandplantingtheflagofsuccess.",Proud,1/5/2020 8:45,PeakConqueror,Twitter, #Proud #ScalingPeaks,23,46,USA,2020,1,5,8
293,"Embracedbythehopefuldawn,agardenersowingseedsofoptimism,tendingtothebloomsofabrightertomorrow.",Hopeful,7/17/2022 6:15,DawnGardener,Instagram, #Hopeful #SeedsOfOptimism,14,28,India,2022,7,17,6
294,"Aplayfulescapadeinthecarnivaloflife,carousellaughterandcottoncandydreamsswirlinginthejoyousatmosphere.",Playful,8/22/2018 17:20,CarnivalDreamer,Facebook, #Playful #CarnivalEscapade,24,48,Australia,2018,8,22,17
295,"Drowningintheabyssofdespair,aheartshatteredintofragments,lostintheechoingsilenceofhopelessness.",Despair,9/15/2021 16:00,ShatteredHeart,Instagram, #Despair #EchoingSilence,8,16,Canada,2021,9,15,16
296,"Bitternessfesteringlikeavenomousvine,entwiningthesoulinawebofresentment,poisoningthegardenofpeace.",Bitterness,3/8/2019 14:20,VenomousSoul,Facebook, #Bitterness #ResentmentWeb,12,24,UK,2019,3,8,14
297,"Wanderingthroughthedesertofloneliness,eachstepaheavysigh,miragesofconnectionshimmeringbutnevermaterializing.",Loneliness,7/20/2017 11:45,DesertWanderer,Twitter, #Loneliness #MiragesOfConnection,15,30,USA,2017,7,20,11
298,"Yearningforatouchthat'snotthere,echoesofadistantwarmthhauntingtheheartinthecoldembraceofsolitude.",Yearning,11/2/2020 19:30,ColdEmbrace,Instagram, #Yearning #DistantWarmth,10,20,Australia,2020,11,2,19
299,"Eyeswideopeninthenight,fearfulshadowsdancingonthewalls,themindaprisonerofimaginedhorrors.",Fearful,5/12/2022 2:00,NightPrisoner,Facebook, #Fearful #ImaginedHorrors,18,36,India,2022,5,12,2
300,"Apprehensivestepsonthetightropeofuncertainty,abalancingactwherethefallseemsinevitable,anxietyaconstantcompanion.",Apprehensive,4/8/2023 13:15,TightropeWalker,Twitter, #Apprehensive #BalancingAct,14,28,UK,2023,4,8,13
301,"Overwhelmedbytheweightoftheworld,Atlaswithtremblingshoulders,eachresponsibilityaboulderinthelandscapeofexhaustion.",Overwhelmed,6/25/2021 17:50,AtlasBearer,Instagram, #Overwhelmed #BouldersOfExhaustion,22,44,Canada,2021,6,25,17
302,"Jealousy,agreen-eyedmonster,lurkingintheshadows,castingadarkcloudoverthesunshineofothers'success.",Jealous,8/30/2019 10:10,GreenMonster,Facebook, #Jealous #GreenEyedMonster,16,32,USA,2019,8,30,10
303,"Devastatedbythestormofbetrayal,thewreckageoftrustscatteredlikedebris,ahearttornbythewindsofbrokenpromises.",Devastated,8/3/2022 15:30,StormSurvivor,Twitter, #Devastated #WindsOfBrokenPromises,25,50,Australia,2022,8,3,15
304,"Frustratedfingerstappingonthekeyboard,asymphonyofannoyancecomposinganunsolvablepuzzleofunmetexpectations.",Frustrated,12/17/2020 9:20,PuzzleComposer,Instagram, #Frustrated #UnsolvablePuzzle,12,24,India,2020,12,17,9
305,"Enviouseyesfixatedonthegildedprize,aheartachefueledbythepainfuldesireforpossessionsthatseemforeveroutofreach.",Envious,2/28/2021 22:45,GildedHeartache,Facebook, #Envious #GildedPrize,20,40,USA,2021,2,28,22
306,"Dismissiveglances,afortressbuiltwithindifference,wallsimpenetrabletothepleasofunderstandingandrecognition.",Dismissive,5/10/2018 14:00,IndifferentFort,Twitter, #Dismissive #ImpenetrableWalls,14,28,UK,2018,5,10,14
307,"Shattereddreamslieonthefloorlikefragmentsofglass,amosaicofdisappointmentcraftedbythehandsoffrustration.",Frustrated,1/7/2022 11:10,DreamMosaic,Instagram, #Frustrated #MosaicOfDisappointment,15,30,Canada,2022,1,7,11
308,"Loneliness,asilentcompanioninthenight,theonlyechointhechamberofsolitude,aheart'ssolitarynocturne.",Loneliness,9/19/2019 3:30,NocturnalEcho,Facebook, #Loneliness #SolitaryNocturne,18,36,Australia,2019,9,19,3
309,"Fearfulwhispersinthedark,themindhauntedbythespecteroftheunknown,shadowsdancingtotherhythmofanxiety'stune.",Fearful,7/14/2023 23:00,DarkWhispers,Twitter, #Fearful #SpecterOfTheUnknown,13,26,UK,2023,7,14,23
310,"Bitterness,abitteraftertastelingeringonthetongue,eachwordareminderofwoundsthatrefusetohealwiththepassingoftime.",Bitterness,4/5/2020 16:20,LingeringTaste,Instagram, #Bitterness #BitterAftertaste,10,20,India,2020,4,5,16
311,"Overwhelmedbythecacophonyofexpectations,adrowningsoulinthetempestofpressure,strugglingtostayafloat.",Overwhelmed,11/29/2021 8:45,TempestSurvivor,Facebook, #Overwhelmed #DrowningSoul,20,40,USA,2021,11,29,8
312,"Jealousy,avenomthatseepsthroughtheveins,poisoningtheheartandturningitintoabreedinggroundfordiscontent.",Jealous,12/12/2019 17:00,VenomousHeart,Twitter, #Jealous #HeartOfDiscontent,16,32,Australia,2019,12,12,17
313,"Devastatedbytherevelationofbetrayal,thetrustshatteredlikefragileglass,leavingshardsofpaininitswake.",Devastated,5/20/2022 14:50,FragileTrust,Instagram, #Devastated #ShatteredTrust,25,50,Canada,2022,5,20,14
314,"Frustratedattemptstomendabrokenconnection,thethreadsofunderstandingslippingthroughthefingerslikegrainsofsand.",Frustrated,9/3/2020 12:15,BrokenThreads,Facebook, #Frustrated #SlippingThreads,14,28,UK,2020,9,3,12
315,"Enviousgazescastuponthepodiumofsuccess,abitterpillswallowed,thetastelingeringasaconstantreminderofunattainedheights.",Envious,2/10/2021 19:30,SuccessPill,Twitter, #Envious #BitterPill,20,40,USA,2021,2,10,19
316,"Dismissivegestures,acurtaindrawntoshieldthevulnerability,astagewhereemotionstakeabackseattotheperformanceofindifference.",Dismissive,8/18/2018 14:40,CurtainShield,Instagram, #Dismissive #IndifferencePerformance,12,24,Australia,2018,8,18,14
317,"Despairlikeaheavyfog,envelopingeverythought,blurringthepathahead,ajourneyinthelabyrinthofutterhopelessness.",Despair,2/28/2022 21:00,FoggyLabyrinth,Facebook, #Despair #LabyrinthOfHopelessness,8,16,Canada,2022,2,28,21
318,"Bitterness,abitterchillintheair,freezingmomentsintoiciclesofresentmentthatdangleprecariouslyoverthelandscapeofmemory.",Bitterness,10/15/2019 10:30,IcyResentment,Twitter, #Bitterness #IciclesOfResentment,15,30,UK,2019,10,15,10
319,"Loneliness,asolitarymooninastarlesssky,castingacoldglowonthelandscapeofisolation,whereechoesbounceinemptyspaces.",Loneliness,12/1/2017 18:50,SolitaryMoon,Instagram, #Loneliness #StarlessSky,18,36,USA,2017,12,1,18
320,"Yearningforthewarmthofavanishedsun,aheartachepaintedinthehuesofasunsetthatnevergracedthehorizon.",Yearning,4/18/2020 16:15,VanishedSunset,Facebook, #Yearning #HuesOfSunset,10,20,Australia,2020,4,18,16
321,"Fearfuleyesscanningtheshadows,aprisonerofthenight,terrorizedbythelurkingmonstersbornfromthemind'sdarkestcorners.",Fearful,1/7/2023 3:30,NightPrisoner,Twitter, #Fearful #LurkingMonsters,18,36,India,2023,1,7,3
322,"Apprehensivewhispersinthewind,aforecastofuncertainty,themind'sweathervanespinningwildlyinthestormofdoubt.",Apprehensive,6/10/2021 10:00,WindWhisperer,Instagram, #Apprehensive #StormOfDoubt,14,28,Canada,2021,6,10,10
323,"Overwhelmedbythemazeofexpectations,aminotaurofpressurelurkinginthelabyrinth,waitingtodevourthespiritofresilience.",Overwhelmed,2/22/2020 15:20,MazeExplorer,Facebook, #Overwhelmed #MinotaurOfPressure,22,44,USA,2020,2,22,15
324,"Jealousy,afesteringwound,thepainintensifyingwitheachglanceatthegardenofothers'achievements,bloomingbeyondthefence.",Jealous,3/17/2018 14:45,WoundedGarden,Twitter, #Jealous #BloomingAchievements,16,32,UK,2018,3,17,14
325,"Devastated,aheartinruins,theechoesofshattereddreamsreverberatinginthechambers,arequiemforwhatoncewaswhole.",Devastated,10/28/2022 11:15,RuinedHeart,Instagram, #Devastated #EchoesOfShatteredDreams,25,50,Australia,2022,10,28,11
326,"Frustratedattemptstountangletheknotofconfusion,thethreadsofunderstandingslippingfurtherintothelabyrinthofmiscommunication.",Frustrated,11/1/2020 12:30,KnotUntangler,Facebook, #Frustrated #LabyrinthOfMiscommunication,14,28,India,2020,11,1,12
327,"Enviouseyeslockedonthetreasurechestofopportunities,aheartachefueledbythedesireforkeysthatseemforeverelusive.",Envious,1/15/2021 22:10,ElusiveKeys,Twitter, #Envious #DesireForKeys,20,40,USA,2021,1,15,22
328,"Dismissivegestures,acurtaindrawntoshieldthevulnerability,astagewhereemotionstakeabackseattotheperformanceofindifference.",Dismissive,8/18/2018 14:00,IndifferentFort,Instagram, #Dismissive #IndifferencePerformance,12,24,Australia,2018,8,18,14
329,"Shattereddreamslieonthefloorlikefragmentsofglass,amosaicofdisappointmentcraftedbythehandsoffrustration.",Frustrated,1/7/2022 11:10,DreamMosaic,Twitter, #Frustrated #MosaicOfDisappointment,15,30,Canada,2022,1,7,11
330,"Loneliness,asilentcompanioninthenight,theonlyechointhechamberofsolitude,aheart'ssolitarynocturne.",Loneliness,9/19/2019 3:30,NocturnalEcho,Facebook, #Loneliness #SolitaryNocturne,18,36,Australia,2019,9,19,3
331,Awe-struckbythebreathtakingsunriseoverthemountains.,Awe,4/3/2022 6:15,NatureAdmirer,Instagram, #Awe #BreathtakingSunrise,28,55,USA,2022,4,3,6
332,Navigatingthroughthechallengeswithdetermination.,Determination,10/12/2023 10:30,GoalPursuer,Twitter, #Determination #Challenges,15,30,Canada,2023,10,12,10
333,Nostalgiahitswhileflippingthroughanoldphotoalbum.,Nostalgia,6/28/2019 19:00,MemoryLane,Facebook, #Nostalgia #OldMemories,22,45,UK,2019,6,28,19
334,Thrilledtowitnessthegrandeurofaculturalfestival.,Thrill,9/15/2020 14:45,CultureEnthusiast,Instagram, #Thrill #CulturalCelebration,40,80,India,2020,9,15,14
335,Calmnessfoundintherhythmofraindropsonthewindowpane.,Calmness,11/8/2017 21:20,RainWatcher,Twitter, #Calmness #RainyDays,18,35,Australia,2017,11,8,21
336,Overwhelmedbythesupportreceivedduringapersonalchallenge.,Overwhelmed,5/20/2021 17:30,PersonalJourney,Facebook, #Overwhelmed #SupportiveCommunity,25,50,USA,2021,5,20,17
337,Excitementbuildsasthecountdowntoalong-awaitedvacationbegins.,Excitement,1/10/2023 12:00,VacationDreamer,Instagram, #Excitement #VacationCountdown,30,60,France,2023,1,10,12
338,"Reflectingonlife'sjourney,gratefulforthelessonslearned.",Gratitude,12/5/2018 8:45,LifeLearner,Twitter, #Gratitude #LifeLessons,35,70,Brazil,2018,12,5,8
339,Bittersweetemotionsarisewhilebiddingfarewelltoadearfriend.,Bittersweet,3/15/2020 18:30,FarewellSender,Instagram, #Bittersweet #Farewell,20,40,Japan,2020,3,15,18
340,Curiositysparkedbyexploringamysteriousancientruin.,Curiosity,8/22/2016 15:10,HistoryExplorer,Facebook, #Curiosity #AncientDiscovery,18,35,Greece,2016,8,22,15
341,Admirationfortheintricatedetailsofahandcraftedmasterpiece.,Admiration,8/20/2019 16:00,CraftEnthusiast,Instagram, #Admiration #HandcraftedArt,25,50,USA,2019,8,20,16
342,Overjoyedbythewarmthofacozyfireplaceonawinterevening.,Overjoyed,12/8/2021 19:30,WinterLover,Twitter, #Overjoyed #WinterWarmth,18,35,Canada,2021,12,8,19
343,Inspirationstrikeswhileobservingthecolorsofavibrantsunset.,Inspiration,6/10/2020 20:45,SunsetWatcher,Instagram, #Inspiration #ColorfulSunset,30,60,UK,2020,6,10,20
344,Motivatedtoachievefitnessgoalsafteraninvigoratingworkout.,Motivation,2/28/2022 7:15,FitnessJunkie,Facebook, #Motivation #FitnessGoals,40,80,Australia,2022,2,28,7
345,Gratitudeforthesimplejoysfoundinacupofmorningcoffee.,Gratitude,4/15/2017 8:00,CoffeeLover,Twitter, #Gratitude #MorningCoffee,22,45,India,2017,4,15,8
346,Feelingempoweredafterconqueringachallenginghikingtrail.,Empowerment,9/5/2018 14:20,HikingExplorer,Instagram, #Empowerment #HikingAdventure,35,70,USA,2018,9,5,14
347,Amusedbytheanticsofplayfulkittensduringplaytime.,Amusement,10/22/2022 12:45,KittyObserver,Facebook, #Amusement #PlayfulKittens,15,30,Canada,2022,10,22,12
348,Contemplatinglife'smysteriesunderthestarrynightsky.,Contemplation,7/2/2016 23:30,Stargazer,Twitter, #Contemplation #StarryNight,28,55,UK,2016,7,2,23
349,Joyfulreunionwithlong-lostfriendsafteryearsofseparation.,JoyfulReunion,11/18/2020 17:10,FriendshipRenewal,Instagram, #JoyfulReunion #Friendship,20,40,India,2020,11,18,17
350,Excitementbuildswhilepreparingforasurprisecelebration.,Excitement,3/5/2023 15:00,CelebrationPlanner,Facebook, #Excitement #SurpriseCelebration,30,60,Australia,2023,3,5,15
351,SatisfactionderivedfromsuccessfullycompletingaDIYproject.,Satisfaction,12/1/2015 11:30,DIYEnthusiast,Twitter, #Satisfaction #DIYProject,25,50,USA,2015,12,1,11
352,Feelingblessedforthesupportivecommunityintimesofneed.,Blessed,9/10/2021 9:45,CommunityHelper,Instagram, #Blessed #SupportiveCommunity,18,35,UK,2021,9,10,9
353,Captivatedbytheserenityofatranquilgardeninfullbloom.,Serenity,5/12/2018 14:20,GardenEnthusiast,Facebook, #Serenity #TranquilGarden,22,45,Canada,2018,5,12,14
354,Anticipationforanupcomingadventureinanexoticdestination.,Anticipation,7/25/2022 10:00,Wanderlust,Twitter, #Anticipation #AdventureAwaits,40,80,India,2022,7,25,10
355,Reflectingonpersonalgrowthachievedthroughlifeexperiences.,Reflection,3/8/2019 18:30,GrowthSeeker,Instagram, #Reflection #PersonalGrowth,35,70,USA,2019,3,8,18
356,Nostalgicmemoriesfloodinwhilerevisitingchildhoodfavorites.,Nostalgia,1/28/2017 21:15,ChildhoodMemories,Facebook, #Nostalgia #ChildhoodFavorites,20,40,Australia,2017,1,28,21
357,Appreciationforthevibrantcultureexperiencedduringtravel.,Appreciation,11/14/2016 13:45,CultureExplorer,Twitter, #Appreciation #CulturalExperience,28,55,UK,2016,11,14,13
358,Confidencesoarsafterovercomingpublicspeakinganxiety.,Confidence,4/2/2020 17:30,PublicSpeaker,Instagram, #Confidence #OvercomingAnxiety,15,30,USA,2020,4,2,17
359,Contentmentinthemidstofafamilygatheringfilledwithlaughter.,Contentment,1/15/2023 19:00,FamilyCelebration,Facebook, #Contentment #FamilyLaughter,25,50,Canada,2023,1,15,19
360,Enthusiasmforlearningnewskillsandexpandingknowledge.,Enthusiasm,8/7/2018 12:15,LifelongLearner,Twitter, #Enthusiasm #SkillBuilding,30,60,India,2018,8,7,12
361,Surpriseanddelightatdiscoveringahiddengeminthecity.,Surprise,10/18/2019 16:45,CityExplorer,Instagram, #Surprise #HiddenGem,18,35,UK,2019,10,18,16
362,Asenseofaccomplishmentaftercompletingachallengingworkout.,Accomplishment,6/30/2022 7:00,FitnessAchiever,Facebook, #Accomplishment #FitnessSuccess,22,45,Australia,2022,6,30,7
363,Wondermentatthebeautyofadoublerainbowaftertherain.,Wonderment,6/12/2017 18:20,RainbowChaser,Twitter, #Wonderment #DoubleRainbow,35,70,USA,2017,6,12,18
364,Optimismforabrightfutureamidstchallengingtimes.,Optimism,7/5/2021 9:30,FutureOptimist,Instagram, #Optimism #BrightFuture,20,40,Canada,2021,7,5,9
365,Prideinachievingapersonalmilestoneincareerprogression.,Pride,4/15/2016 14:50,CareerAchiever,Facebook, #Pride #CareerMilestone,28,55,UK,2016,4,15,14
366,Happinessbloomslikeflowersinagardenonasunnyday.,Happiness,2/10/2020 11:15,SunnyDayEnthusiast,Twitter, #Happiness #SunnyDay,15,30,India,2020,2,10,11
367,Elationoverdiscoveringararebookinaquaintbookstore.,Elation,9/22/2018 16:30,Bookworm,Instagram, #Elation #RareBookDiscovery,40,80,USA,2018,9,22,16
368,Curiositypiquedbythemysteriesofanancientarchaeologicalsite.,Curiosity,11/8/2015 10:00,ArchaeologyEnthusiast,Facebook, #Curiosity #AncientMysteries,18,35,Australia,2015,11,8,10
369,Mesmerizedbythecosmicdanceoffirefliesonamoonlitnight.,Enchantment,8/10/2022 22:00,NightSkyObserver,Instagram, #Enchantment #CosmicFireflies,25,50,Brazil,2022,8,10,22
370,Intriguedbythesymphonyofcolorsinanabstractartexhibition.,Intrigue,4/5/2019 17:30,ArtConnoisseur,Twitter, #Intrigue #AbstractArt,18,35,France,2019,4,5,17
371,Gigglesandjoyechointheairduringachildren'splaydate.,PlayfulJoy,12/15/2020 15:45,PlayfulParent,Facebook, #PlayfulJoy #ChildrensPlaydate,22,45,Japan,2020,12,15,15
372,Envelopedinserenitywhilepracticingmindfulnessbythelake.,Mindfulness,10/20/2017 8:15,ZenSeeker,Instagram, #Mindfulness #LakeTranquility,35,70,Canada,2017,10,20,8
373,Chasingdreamslikeakitesoaringhighinthevastopensky.,DreamChaser,2/28/2021 13:00,SkyDreamer,Twitter, #DreamChaser #SkyHighDreams,30,60,Australia,2021,2,28,13
374,Spellboundbytheeleganceofaballroomdanceundercrystalchandeliers.,Elegance,6/12/2018 20:30,DanceEnthusiast,Facebook, #Elegance #BallroomDance,28,55,UK,2018,6,12,20
375,Whimsicaldelightinaworldoffairytalesandmagicalcreatures.,Whimsy,3/8/2016 14:20,FairyTaleExplorer,Instagram, #Whimsy #MagicalWorld,20,40,USA,2016,3,8,14
376,Pensivecontemplationamidtheancientruinsofaforgottencivilization.,Pensive,4/18/2023 17:10,RuinsExplorer,Twitter, #Pensive #AncientCivilization,18,35,Greece,2023,4,18,17
377,Embracingthethrillofspeedonarollercoaster'sexhilaratingtwists.,Thrill,7/25/2020 12:45,RollercoasterFan,Facebook, #Thrill #RollercoasterAdventure,22,45,Germany,2020,7,25,12
378,Harmonyresonatesasmusiciansplayamelodyofunityandtogetherness.,Harmony,11/30/2019 19:30,MusicHarmonist,Instagram, #Harmony #MusicalUnity,35,70,Sweden,2019,11,30,19
379,Aburstofcreativityinthequietsolitudeofanartist'sstudio.,Creativity,9/1/2015 16:00,StudioArtist,Twitter, #Creativity #ArtistsHaven,15,30,Italy,2015,9,1,16
380,Radiantjoyakintobloomingflowersonasun-kissedspringmorning.,Radiance,5/5/2022 10:15,SpringEnthusiast,Facebook, #Radiance #SpringBlooms,25,50,Netherlands,2022,5,5,10
381,Asenseofwonderatthevastnessofthecosmosonastargazingnight.,Wonder,7/8/2018 23:00,CosmosExplorer,Instagram, #Wonder #StargazingAdventure,40,80,SouthAfrica,2018,7,8,23
382,Rejuvenatedbythesaltybreezeandthesoundofwavesattheseaside.,Rejuvenation,9/20/2021 14:30,SeaBreezeLover,Twitter, #Rejuvenation #SeasideEscape,18,35,Spain,2021,9,20,14
383,Whispersofinspirationfromtherustlingleavesinasereneforest.,Inspiration,11/15/2016 11:45,ForestDreamer,Facebook, #Inspiration #ForestWhispers,28,55,Portugal,2016,11,15,11
384,Savoringthewarmthofacupofcocoaonachillywinterevening.,Coziness,1/12/2020 18:00,WinterWarmth,Instagram, #Coziness #WarmWinterEvening,30,60,Switzerland,2020,1,12,18
385,Heartfeltgratitudeforthelaughtersharedduringafamilyreunion.,Gratitude,12/28/2017 19:15,FamilyGatherer,Facebook, #Gratitude #FamilyLaughter,22,45,Austria,2017,12,28,19
386,"Embarkingonaculinaryadventure,savoringexoticflavorsaroundtheworld.",Adventure,3/2/2019 20:20,CulinaryExplorer,Twitter, #Adventure #CulinaryJourney,35,70,Belgium,2019,3,2,20
387,Euphoriafloodsinasthefinalpuzzlepiececlicksintoplace.,Euphoria,6/8/2022 15:30,PuzzleSolver,Instagram, #Euphoria #PuzzleCompletion,20,40,Denmark,2022,6,8,15
388,Awe-inspiredbythegrandeurofanancientcathedral'sintricatearchitecture.,Awe,8/18/2018 14:45,CathedralVisitor,Facebook, #Awe #ArchitecturalGrandeur,18,35,CzechRepublic,2018,8,18,14
389,Captivatedbytheetherealbeautyofafieldfilledwithfireflies.,Enchantment,8/10/2022 22:00,NightSkyObserver,Instagram, #Enchantment #FireflyField,25,50,Brazil,2022,8,10,22
390,Immersedintheenchantingmelodiesofastreetmusician'sviolin.,Melodic,4/5/2019 17:30,MusicLover,Twitter, #Melodic #StreetMusic,18,35,France,2019,4,5,17
391,Joyfullaughterresonatesthroughalivelysummercarnival.,FestiveJoy,12/15/2020 15:45,CarnivalGoer,Facebook, #FestiveJoy #SummerCarnival,22,45,Japan,2020,12,15,15
392,Exploringtheuniversewithinduringamindfulmeditationsession.,InnerJourney,10/20/2017 8:15,MindfulExplorer,Instagram, #InnerJourney #MeditationBliss,35,70,Canada,2017,10,20,8
393,Soaringlikeafreespiritonthewindsofacoastalcliff.,Freedom,2/28/2021 13:00,CoastalExplorer,Twitter, #Freedom #CoastalAdventure,30,60,Australia,2021,2,28,13
394,Dazzledbytheeleganceofamasqueradeball'sdazzlingcostumes.,Dazzle,6/12/2018 20:30,MasqueradeAttendee,Facebook, #Dazzle #MasqueradeElegance,28,55,UK,2018,6,12,20
395,Whimsicaldelightinaworldofwhimsicalfairytales.,Whimsy,3/8/2016 14:20,FairyTaleAdventurer,Instagram, #Whimsy #FairyTaleMagic,20,40,USA,2016,3,8,14
396,Reflectivecontemplationamidtheruinsofaforgottenera.,Reflection,4/18/2023 17:10,RuinsExplorer,Twitter, #Reflection #ForgottenEra,18,35,Greece,2023,4,18,17
397,Ridingtheadrenalinerushonarollercoaster'swildtwists.,Adrenaline,7/25/2020 12:45,ThrillSeeker,Facebook, #Adrenaline #RollercoasterThrills,22,45,Germany,2020,7,25,12
398,Harmonyresonatesasmusiciansplayasymphonyofunity.,Harmony,11/30/2019 19:30,MusicHarmonist,Instagram, #Harmony #MusicalUnity,35,70,Sweden,2019,11,30,19
399,Aburstofartisticcreativityinthequietudeofanartist'sstudio.,ArtisticBurst,9/1/2015 16:00,StudioArtist,Twitter, #ArtisticBurst #StudioCreativity,15,30,Italy,2015,9,1,16
400,Radiantjoyakintoblossomingflowersonasunlitspringmorning.,Radiance,5/5/2022 10:15,SpringEnthusiast,Facebook, #Radiance #SpringBlooms,25,50,Netherlands,2022,5,5,10
401,Awe-inspiredbythevastnessofthecosmosonastargazingnight.,Wonder,7/8/2018 23:00,CosmosExplorer,Instagram, #Wonder #StargazingAdventure,40,80,SouthAfrica,2018,7,8,23
402,Rejuvenatedbythesaltybreezeandthesoundofwavesattheseaside.,Rejuvenation,9/20/2021 14:30,SeaBreezeLover,Twitter, #Rejuvenation #SeasideEscape,18,35,Spain,2021,9,20,14
403,Whispersofinspirationfromtherustlingleavesinasereneforest.,Inspiration,11/15/2016 11:45,ForestDreamer,Facebook, #Inspiration #ForestWhispers,28,55,Portugal,2016,11,15,11
404,Savoringthewarmthofacupofcocoaonachillywinterevening.,Coziness,1/12/2020 18:00,WinterWarmth,Instagram, #Coziness #WarmWinterEvening,30,60,Switzerland,2020,1,12,18
405,Heartfeltgratitudeforthelaughtersharedduringafamilyreunion.,Gratitude,12/28/2017 19:15,FamilyGatherer,Facebook, #Gratitude #FamilyLaughter,22,45,Austria,2017,12,28,19
406,"Embarkingonaculinaryodyssey,savoringflavorsaroundtheworld.",CulinaryOdyssey,3/2/2019 20:20,CulinaryExplorer,Twitter, #CulinaryOdyssey #FlavorsAroundTheWorld,35,70,Belgium,2019,3,2,20
407,Euphoriafloodsinasthefinalpuzzlepiecefitsperfectly.,Euphoria,6/8/2022 15:30,PuzzleSolver,Instagram, #Euphoria #PerfectPuzzle,20,40,Denmark,2022,6,8,15
408,Awe-struckbythegrandeurofanancientcathedral'sintricatearchitecture.,Awe,8/18/2018 14:45,CathedralVisitor,Facebook, #Awe #ArchitecturalGrandeur,18,35,CzechRepublic,2018,8,18,14
409,Curiosityawakenedbythemysteriesofanancientarchaeologicalsite.,Curiosity,11/8/2015 10:00,ArchaeologyEnthusiast,Instagram, #Curiosity #AncientMysteries,18,35,Australia,2015,11,8,10
410,Giddywithexcitementasthefirstsnowflakesdancefromthesky.,Excitement,12/2/2020 17:30,SnowfallEnthusiast,Twitter, #Excitement #SnowfallMagic,22,45,Canada,2020,12,2,17
411,Contentmentenvelopsasthearomaoffreshlybakedbreadfillstheair.,Contentment,6/10/2017 12:15,BreadLover,Instagram, #Contentment #FreshBreadAroma,28,55,France,2017,6,10,12
412,Inspiredbytheresilienceofalonetreestandingtallinastorm.,Resilience,4/15/2021 14:20,NatureResilient,Facebook, #Resilience #StandingTall,35,70,USA,2021,4,15,14
413,"Lostinthepagesofacaptivatingnovel,transportedtoanotherworld.",Immersion,9/28/2019 19:45,Bookworm,Twitter, #Immersion #CaptivatingNovel,20,40,UK,2019,9,28,19
414,Drenchedinnostalgiawhileflippingthroughanoldfamilyphotoalbum.,Nostalgia,12/5/2016 21:00,FamilyHistorian,Instagram, #Nostalgia #FamilyPhotoAlbum,25,50,India,2016,12,5,21
415,Sparkofinspirationigniteslikeashootingstarinthenightsky.,Spark,2/10/2018 23:30,NightSkyWatcher,Facebook, #Spark #InspirationIgnited,30,60,Australia,2018,2,10,23
416,Imbuedwithgratitudeforthesimplepleasureofawarmcupoftea.,Gratitude,2/15/2023 8:30,TeaEnthusiast,Twitter, #Gratitude #WarmTea,18,35,Japan,2023,2,15,8
417,Marvelingatthekaleidoscopeofcolorsinavibrantstreetmarket.,Marvel,8/22/2015 15:00,MarketExplorer,Instagram, #Marvel #ColorfulStreetMarket,22,45,Brazil,2015,8,22,15
418,Awashwithserenityasthesunsetsoveratranquillakesideretreat.,Serenity,11/20/2020 18:45,LakesideRetreater,Facebook, #Serenity #TranquilSunset,28,55,Germany,2020,11,20,18
419,Drowninginsorrowasmemoriesoflostloveresurface.,Heartbreak,8/5/2019 21:00,LostInLove,Instagram, #Heartbreak #LostLove,15,30,USA,2019,8,5,21
420,Numbnesssetsinastheweightoflonelinessgrowsheavier.,Loneliness,2/12/2021 16:45,SolitudeSeeker,Twitter, #Loneliness #HeavyHeart,18,35,Canada,2021,2,12,16
421,"Tearsfalllikeraindrops,mourningtheendofacherishedfriendship.",Grief,11/28/2020 14:20,FriendshipsEnd,Facebook, #Grief #LostFriendship,22,45,UK,2020,11,28,14
422,"Despaircloudsthemind,feelingadriftinanendlessseaofdarkness.",Despair,5/15/2016 22:30,LostInDarkness,Instagram, #Despair #EndlessDarkness,28,55,Australia,2016,5,15,22
423,"Shatteredbybetrayal,trustcrumbleslikefragileglass.",Betrayal,9/10/2018 13:15,BrokenTrust,Twitter, #Betrayal #ShatteredTrust,22,45,Germany,2018,9,10,13
424,"Achingheart,thesymphonyofpainplaysinthesilenceofsolitude.",Suffering,3/20/2022 19:30,SilentSufferer,Facebook, #Suffering #HeartacheSymphony,25,50,Brazil,2022,3,20,19
425,"Emotionalstorm,awhirlwindofsadnessengulfseverythought.",EmotionalStorm,7/18/2017 17:45,StormyFeelings,Instagram, #EmotionalStorm #SadnessWhirlwind,30,60,India,2017,7,18,17
426,"Hauntedbyregrets,theghostofthepastlingersrelentlessly.",Regret,12/15/2018 10:00,LingeringGhost,Twitter, #Regret #HauntedPast,18,35,France,2018,12,15,10
427,"Tornapartbygrief,theechoesoflossreverberatethroughthesoul.",Grief,6/28/2015 21:15,EchoesOfLoss,Facebook, #Grief #TornApart,28,55,Italy,2015,6,28,21
428,"Isolationdeepens,anemotionalwinterwherewarmthisbutadistantmemory.",Isolation,4/2/2020 14:20,WinterOfEmotions,Instagram, #Isolation #EmotionalWinter,35,70,Japan,2020,4,2,14
429,"Soul-crushingdisappointment,hopesshatteredlikefragileglass.",Disappointment,10/8/2019 18:30,ShatteredHopes,Twitter, #Disappointment #CrushedHopes,20,40,Spain,2019,10,8,18
430,"Painfulechoesofaloveoncecherished,nowlostintheabyssoftime.",LostLove,11/22/2016 9:45,AbyssOfTime,Facebook, #LostLove #PainfulEchoes,22,45,Netherlands,2016,11,22,9
431,"Heartachedeepens,asolitaryjourneythroughtheabyssofdespair.",Despair,8/18/2022 22:00,SolitaryDescent,Instagram, #Despair #AbyssOfHeartache,40,80,SouthAfrica,2022,8,18,22
432,"Melancholylingers,abittersweetserenadeinthequietudeofsolitude.",Melancholy,3/12/2017 23:30,SerenadeOfSolitude,Twitter, #Melancholy #QuietSerenade,18,35,UK,2017,3,12,23
433,"Bitternesslikeapoison,seepingintoeverycreviceofthewoundedheart.",Bitterness,12/15/2015 16:15,PoisonedHeart,Facebook, #Bitterness #WoundedHeart,25,50,Australia,2015,12,15,16
434,"Emotionalexhaustion,theweightoftheworldcrushingwearyshoulders.",Exhaustion,9/5/2021 13:30,WearySoulCrushed,Instagram, #Exhaustion #CrushedSpirit,35,70,Canada,2021,9,5,13
435,"Sorrowfulechoes,asymphonyofpainplayedbythestringsofloss.",Sorrow,5/22/2018 20:45,StringsOfSorrow,Twitter, #Sorrow #SymphonyOfLoss,18,35,Germany,2018,5,22,20
436,"Darknessdescends,engulfingthesoulintheshadowsofdespair.",Darkness,7/10/2016 18:20,SoulInShadow,Facebook, #Darkness #SoulEngulfed,28,55,USA,2016,7,10,18
437,"Desperationwhispers,thesilentpleaforaglimmerofhopeintheabyss.",Desperation,4/30/2019 14:00,WhisperedDespair,Instagram, #Desperation #GlimmerOfHope,22,45,France,2019,4,30,14
438,"Heartinruins,theremnantsofshattereddreamsscatteredinthewind.",Ruins,1/8/2022 11:30,DreamsInWind,Twitter, #Ruins #ShatteredDreams,20,40,Brazil,2022,1,8,11
439,"Shatteredbytheechoesofashattereddream,fragmentsofhopescattered.",Desolation,9/10/2017 19:15,DreamEchoes,Twitter, #Desolation #ScatteredHope,20,40,Australia,2017,9,10,19
440,"Avoidingthethornsofregret,walkingbarefootonthepathofremorse.",Regret,4/18/2022 11:30,RemorseWalker,Instagram, #Regret #PathOfRemorse,25,50,Canada,2022,4,18,11
441,"Inthelabyrinthofgrief,thewallsechowiththefootstepsoflostjoy.",Grief,12/5/2018 21:45,JoyLabyrinth,Facebook, #Grief #LostJoyFootsteps,18,35,USA,2018,12,5,21
442,"Asouladriftintheseaofsolitude,wavesoflonelinesscrashingrelentlessly.",Loneliness,6/28/2016 14:20,SolitudeSeas,Twitter, #Loneliness #CrashingWaves,22,45,UK,2016,6,28,14
443,"Thebitternessofbetrayal,atastethatlingers,stainingthepalateoftrust.",Bitterness,10/22/2019 17:00,PalateStainer,Instagram, #Bitterness #StainedTrust,15,30,Germany,2019,10,22,17
444,"Intheruinsofhope,echoesofshattereddreamswhispertalesofloss.",Desolation,3/15/2021 22:45,HopeRuins,Facebook, #Desolation #WhisperedLoss,28,55,Brazil,2021,3,15,22
445,"Sinkinglikeastoneintheoceanofheartbreak,eachrippleasighofdespair.",Heartbreak,8/10/2017 19:30,OceanSinker,Twitter, #Heartbreak #RippleOfDespair,22,45,France,2017,8,10,19
446,"Tears,theinkstainingthepagesofajournal,atestamenttosilentgrief.",Grief,1/28/2023 14:30,InkJournalist,Instagram, #Grief #SilentTears,30,60,India,2023,1,28,14
447,"Inthewastelandoflosttrust,theechoesofbrokenpromisesreverberate.",Betrayal,12/12/2016 10:00,TrustWasteland,Facebook, #Betrayal #ReverberatingPromises,25,50,Italy,2016,12,12,10
448,"Avoidingtheshardsofshattereddreams,walkingthetightropeofresilience.",Resilience,7/18/2020 15:15,DreamTightrope,Twitter, #Resilience #TightropeWalk,35,70,Japan,2020,7,18,15
449,"Suffocatinginthesilenceofsolitude,whereechoesoflaughteroncethrived.",Isolation,5/20/2022 20:30,EchoedLaughter,Instagram, #Isolation #SilentSolitude,30,60,SouthAfrica,2022,5,20,20
450,"Hauntedbythespecteroflostpossibilities,aghostthatrefusestofadeaway.",Regret,11/8/2019 14:45,PossibilityGhost,Twitter, #Regret #FadingPossibilities,18,35,Spain,2019,11,8,14
451,"Inthelabyrinthofdespair,theechoesofabrokenheartreverberateendlessly.",Despair,3/28/2017 22:00,EndlessLabyrinth,Facebook, #Despair #EndlessReverberation,28,55,Australia,2017,3,28,22
452,"Sinkinglikeautumnleavesintheriverofsorrow,carriedawaybythecurrent.",Sorrow,9/15/2020 18:15,RiverOfSorrow,Instagram, #Sorrow #AutumnLeaves,22,45,Canada,2020,9,15,18
453,"Inthegardenofbrokendreams,petalsfall,asilenttestimonytoshatteredhopes.",Desolation,6/10/2018 13:30,DreamGardener,Twitter, #Desolation #ShatteredHopes,20,40,UK,2018,6,10,13
454,"Tears,thecurrencyofgrief,spentinthemarketplaceoflostloveandlonging.",Grief,12/22/2016 21:45,CurrencyOfTears,Facebook, #Grief #LostLoveLonging,25,50,USA,2016,12,22,21
455,"Wanderinginthemazeofbetrayal,thewallsclosinginwitheverywrongturn.",Betrayal,1/5/2021 16:20,MazeWanderer,Instagram, #Betrayal #ClosingWalls,15,30,Germany,2021,1,5,16
456,"Asoulweatheredbythestormofheartbreak,seekingrefugeinthecalmafter.",Heartbreak,4/18/2019 11:00,StormSeeker,Twitter, #Heartbreak #CalmAfterStorm,22,45,Brazil,2019,4,18,11
457,"Inthetapestryofdespair,threadsofhopeunravel,leavingaportraitofsorrow.",Despair,8/28/2017 19:30,TapestrySorrow,Facebook, #Despair #UnraveledHope,18,35,India,2017,8,28,19
458,"Likeawitheredroseinthegardenoflove,petalsfall,asilentsurrendertotime.",Loss,2/10/2023 14:30,WitheredRose,Instagram, #Loss #SilentSurrender,28,55,France,2023,2,10,14
459,"Inthevoidofheartache,echoesofalovesongplay,eachnoteapangoflonging.",Heartache,7/10/2022 22:15,LoveSongEcho,Instagram, #Heartache #LoveSongLonging,30,60,Japan,2022,7,10,22
460,"Nostalgia,abittersweetdanceinthemoonlitballroomofcherishedmemories.",Nostalgia,5/15/2019 21:30,MoonlitMemories,Twitter, #Nostalgia #CherishedMemories,18,35,Italy,2019,5,15,21
461,"Inthesymphonyofgrief,eachtearisanote,composingamelancholicmelody.",Grief,11/28/2018 14:00,SymphonyOfTears,Facebook, #Grief #MelancholicMelody,22,45,Germany,2018,11,28,14
462,"Betrayal,avenomousserpentslitheringthroughthegardenoftrust,poisoningroots.",Betrayal,3/2/2021 17:45,VenomousGarden,Instagram, #Betrayal #PoisonedTrust,25,50,Canada,2021,3,2,17
463,"Sinkinginthequicksandofdespair,theharderyoufight,thedeeperyoudescend.",Despair,10/18/2016 19:30,QuicksandFighter,Twitter, #Despair #DeepDescent,20,40,USA,2016,10,18,19
464,"Wanderingthroughthecemeteryoflostdreams,tombstonesmarkinguntoldsorrows.",Desolation,8/15/2020 12:30,DreamCemetery,Facebook, #Desolation #UntoldSorrows,28,55,France,2020,8,15,12
465,"Sweptawaybytheriverofregret,thecurrentsofthepastrefusingtorelease.",Regret,4/28/2017 16:20,RegretRiver,Instagram, #Regret #PastCurrents,18,35,UK,2017,4,28,16
466,"Whispersoflostlovelingerintheatticoftheheart,forgottenbutnoterased.",Loss,9/10/2019 21:00,HeartAttic,Twitter, #Loss #ForgottenLove,22,45,Australia,2019,9,10,21
467,"Inthegalleryofbrokenpromises,eachshatteredvowframed,apainfulexhibition.",Betrayal,1/28/2022 13:45,PromiseGallery,Facebook, #Betrayal #ShatteredVows,15,30,Brazil,2022,1,28,13
468,"Theechoesofsolitude,asilentconversationbetweenasoulanditsshadows.",Solitude,6/15/2016 22:30,EchoedConversation,Instagram, #Solitude #ShadowConversation,30,60,Spain,2016,6,15,22
469,"Dancingonsunshine,eachstepacelebrationofthejoyfoundinsimplemoments.",Joy,8/20/2021 15:45,SunshineDancer,Instagram, #Joy #SimpleMoments,40,80,USA,2021,8,20,15
470,"Laughterechoesintheair,achorusofhappinessthatliftsthespirithigher.",Happiness,4/12/2018 18:30,EchoedLaughter,Twitter, #Happiness #SpiritLifter,35,70,Canada,2018,4,12,18
471,"Inthegardenofcontentment,eachbloomwhisperstalesofinnerpeaceandjoy.",Contentment,2/15/2022 12:20,GardenOfJoy,Facebook, #Contentment #InnerPeace,25,50,UK,2022,2,15,12
472,"Chasingdreamsunderthevibrantsky,ajourneyfueledbyhopeandenthusiasm.",Enthusiasm,10/28/2019 14:15,DreamChaser,Instagram, #Enthusiasm #HopefulJourney,30,60,Australia,2019,10,28,14
473,"Serenadingthestarswithaheartfullofgratitude,amelodyofthankfulness.",Gratitude,12/22/2017 21:00,StarSerenader,Twitter, #Gratitude #ThankfulMelody,22,45,India,2017,12,22,21
474,"Baskingintheglowofaccomplishment,eachmilestoneasteppingstonetohappiness.",Accomplishment,6/10/2020 17:30,GlowAchiever,Facebook, #Accomplishment #HappinessMilestone,28,55,Germany,2020,6,10,17
475,"Inthedanceofpositivity,everystepisarhythm,upliftingthesoulinharmony.",Positivity,9/18/2016 19:45,DanceHarmony,Instagram, #Positivity #SoulUpliftment,18,35,France,2016,9,18,19
476,"Overflowingwithjoy,acupoflaughtersharedwithfriends,amomentcherished.",Joy,3/10/2023 14:30,LaughterCup,Twitter, #Joy #CherishedMoment,20,40,Japan,2023,3,10,14
477,"Drapedinthewarmthofkindness,aquiltofcompassionstitchedwithlove.",Kindness,5/5/2019 12:15,QuiltedCompassion,Facebook, #Kindness #LoveStitches,25,50,Brazil,2019,5,5,12
478,"Inthegardenoffriendships,eachbloomatestamenttothebeautyofcamaraderie.",Friendship,8/28/2018 16:00,FriendshipGarden,Instagram, #Friendship #CamaraderieBlooms,30,60,SouthAfrica,2018,8,28,16
479,"Intheembraceoflove,eachheartbeatisamelody,dancingtotherhythmofaffection.",Love,11/15/2022 20:45,MelodyOfLove,Twitter, #Love #RhythmOfAffection,35,70,USA,2022,11,15,20
480,"Surroundedbythecolorsofjoy,acanvaspaintedwithlaughterandendlesssmiles.",Joy,7/2/2019 17:00,ColorfulLaughter,Instagram, #Joy #EndlessSmiles,40,80,Canada,2019,7,2,17
481,"Inthesymphonyofexcitement,eachnoteisaburstofenergy,ignitingthesoulwithfervor.",Excitement,4/18/2021 14:20,SymphonyFervor,Facebook, #Excitement #IgnitedSoul,30,60,UK,2021,4,18,14
482,"Asurprisegift,wrappedinanticipation,unfoldsamomentofdelightandwonder.",Surprise,2/5/2023 19:30,WrappedDelight,Twitter, #Surprise #WonderfulMoment,25,50,Australia,2023,2,5,19
483,"Lostinthemazeofcuriosity,eachtwistandturnunveilsthetreasuresofdiscovery.",Curiosity,9/22/2018 12:45,MazeDiscovery,Instagram, #Curiosity #TreasuresOfDiscovery,22,45,India,2018,9,22,12
484,"Floatingoncloudsofgratitude,eachraindropablessing,ashowerofthankfulness.",Gratitude,12/10/2016 21:15,CloudsOfBlessings,Facebook, #Gratitude #ShowerOfThankfulness,28,55,Germany,2016,12,10,21
485,"Likeacometofinspiration,streakingthroughtheskyofcreativity,leavingtrailsofbrilliance.",Inspiration,5/28/2020 16:00,CometCreativity,Twitter, #Inspiration #BrilliantTrails,18,35,France,2020,5,28,16
486,"Inthecelebrationofsuccess,fireworksofaccomplishmentlightupthenightskyoftriumph.",Success,11/15/2017 22:30,FireworksTriumph,Instagram, #Success #NightSkyTriumph,22,45,Japan,2017,11,15,22
487,"Asymphonyoflaughter,eachnoteakeytounlockingthedoorofboundlesshappiness.",Happiness,8/2/2021 19:00,LaughterSymphony,Facebook, #Happiness #BoundlessLaughter,30,60,Brazil,2021,8,2,19
488,"Inthecarnivalofemotions,therollercoasterofthrillsendstheheartonawildride.",Thrill,3/28/2019 15:30,EmotionCarnival,Instagram, #Thrill #WildHeartRide,35,70,SouthAfrica,2019,3,28,15
489,"StandingbeforethegrandeuroftheEiffelTower,amomenttoreflectonthebeautyofParisiandreams.",Reflection,5/12/2018 17:30,ParisDreamer,Twitter, #Reflection #ParisianDreams,28,55,France,2018,5,12,17
490,"LostintheenchantmentofDisneyland,eachrideajourneyintotherealmofchildhoodfantasies.",Enchantment,9/28/2022 15:45,DisneylandExplorer,Instagram, #Enchantment #ChildhoodFantasies,30,60,USA,2022,9,28,15
491,"ExploringthewondersofFerrariWorld,theroarofenginescreatingasymphonyofspeed.",Excitement,11/10/2019 14:00,FerrariSpeedster,Facebook, #Excitement #SymphonyOfSpeed,22,45,Italy,2019,11,10,14
492,"AmidstthetulipfieldsofKeukenhof,atapestryofcolorsthatpaintsthesoulwithspringtimejoy.",Joy,4/2/2021 18:20,KeukenhofAdventurer,Instagram, #Joy #SpringtimeColors,35,70,Netherlands,2021,4,2,18
493,"WanderingthroughthehistoricalstreetsofKyoto,eachstepajourneyintotheheartofJapan'straditions.",Exploration,8/22/2017 21:30,KyotoAdventurer,Twitter, #Exploration #JapaneseTraditions,18,35,Japan,2017,8,22,21
494,"IntheembraceoftheGrandCanyon,nature'smasterpiece,amomenttomarvelatEarth'sgrandeur.",Awe,6/15/2020 16:45,CanyonMarveler,Instagram, #Awe #EarthsGrandeur,25,50,USA,2020,6,15,16
495,"JourneyingthroughtheserenityofSantorini,whereeachsunsetpaintstheskywithhuesoftranquility.",Serenity,9/10/2016 19:15,SantoriniTraveler,Facebook, #Serenity #SunsetHues,22,45,Greece,2016,9,10,19
496,"AmazedbythearchitecturalmarvelsofPetra,eachstonetellingtalesofanancientcivilization.",Amazement,1/28/2023 13:00,PetraExplorer,Twitter, #Amazement #AncientTales,30,60,Jordan,2023,1,28,13
497,"EmbarkingonagondolarideinVenice,eachcanalreflectingtheromanceofthistimelesscity.",Romance,4/18/2019 16:30,VeniceRomantic,Instagram, #Romance #TimelessCity,20,40,Italy,2019,4,18,16
498,"AtthesummitofMachuPicchu,abreathtakingpanoramathatwhispersthesecretsofancientcivilizations.",Awe,11/5/2017 22:00,MachuPicchuAdventurer,Facebook, #Awe #AncientCivilizations,28,55,Peru,2017,11,5,22
499,"IntheheartofNewYorkCity,TimesSquaredazzleswithlights,avibrantspectacleofurbanenergy.",Excitement,7/20/2022 21:45,TimesSquareExplorer,Instagram, #Excitement #UrbanEnergy,35,70,USA,2022,7,20,21
500,"CaptivatedbythehistoricalcharmoftheColosseum,eachstoneechoingtalesofgladiatorvalor.",Captivation,3/15/2018 17:30,ColosseumAdventurer,Twitter, #Captivation #GladiatorTales,25,50,Italy,2018,3,15,17
501,"SailingtheazurewatersoftheMaldives,eachwaveawhisperofserenityinparadise.",Serenity,10/28/2019 14:15,MaldivesSailor,Facebook, #Serenity #ParadiseWhispers,22,45,Maldives,2019,10,28,14
502,"InthemidstoftheAmazonrainforest,asymphonyofwildlifecreatesanorchestraofnature'swonders.",Wonder,6/10/2021 16:00,AmazonExplorer,Instagram, #Wonder #NatureOrchestra,30,60,Brazil,2021,6,10,16
503,"WalkingtheGreatWallofChina,eachstepatestamenttoancientengineeringmarvels.",Awe,8/18/2017 19:30,GreatWallWalker,Twitter, #Awe #EngineeringMarvels,18,35,China,2017,8,18,19
504,"AtthesummitofMountFuji,abreathtakingsunrisethatpaintstheskywithhuesofaccomplishment.",Accomplishment,4/15/2020 5:30,FujiSummitAchiever,Facebook, #Accomplishment #SunriseHues,28,55,Japan,2020,4,15,5
505,"ExploringtheancientruinsofAngkorWat,eachstonewhisperingstoriesofKhmercivilization.",Exploration,11/22/2016 13:00,AngkorWatAdventurer,Instagram, #Exploration #KhmerStories,20,40,Cambodia,2016,11,22,13
506,"SkiingdowntheslopesoftheSwissAlps,eachturnadancewiththemajestyofsnow-cappedpeaks.",Adventure,1/10/2019 14:45,AlpsSkiAdventurer,Twitter, #Adventure #SnowPeakDance,22,45,Switzerland,2019,1,10,14
507,"InthetranquilityofKyoto'sbambooforest,whispersofancientZenwisdomechothroughthegroves.",Tranquility,2/28/2023 16:20,KyotoBambooSeeker,Facebook, #Tranquility #ZenWisdom,25,50,Japan,2023,2,28,16
508,"CruisingthefjordsofNorway,eachicylandscapeabreathtakingmasterpieceofnature'sgrandeur.",Grandeur,5/28/2018 18:30,NorwayFjordExplorer,Instagram, #Grandeur #IcyMasterpiece,22,45,Norway,2018,5,28,18
509,"AtthefrontrowofAdele'sconcert,eachnoteof'SomeoneLikeYou'resonateswithsoul-stirringemotion.",Emotion,9/15/2022 20:00,AdeleConcertGoer,Instagram, #Emotion #AdeleConcert,40,80,USA,2022,9,15,20
510,"DancingunderthestarsatBeyonc'sliveshow,feelingthepowerof'SingleLadies'ineverymove.",Energy,7/28/2019 21:30,BeyonceDancer,Twitter, #Energy #BeyonceConcert,35,70,USA,2019,7,28,21
511,"InthecrowdofaTaylorSwiftconcert,thelyricsof'LoveStory'createanenchantingfairytale.",Enchantment,5/10/2021 19:45,SwiftieDreamer,Facebook, #Enchantment #TaylorSwift,30,60,USA,2021,5,10,19
512,"RockingouttotheguitarsolosataQueentributeconcert,ajourneybackintimewithFreddie'sspirit.",Nostalgia,12/2/2018 22:15,QueenTributeFan,Instagram, #Nostalgia #QueenTribute,22,45,UK,2018,12,2,22
513,"SwayingtoEdSheeran'sacousticmelodies,asereneeveningfilledwith'Perfect'moments.",Serenity,8/18/2020 19:00,SheeranMelodyLover,Twitter, #Serenity #EdSheeranConcert,18,35,UK,2020,8,18,19
514,"ImmersedinthepulsatingbeatsofaBrunoMarsconcert,where'UptownFunk'becomesacityofjoy.",Joy,3/28/2017 20:30,MarsJoyExplorer,Facebook, #Joy #BrunoMars,28,55,USA,2017,3,28,20
515,"AtaMichaelJacksontributeshow,moonwalkingthroughthehits,acelebrationoftheKingofPop.",Celebration,1/15/2022 21:15,MJTributeDancer,Instagram, #Celebration #MJTribute,25,50,USA,2022,1,15,21
516,"SwingingtotherhythmsofaFrankSinatratribute,feelingthetimelesscharmof'FlyMetotheMoon'.",Charm,6/10/2019 18:45,SinatraCharmListener,Twitter, #Charm #SinatraTribute,22,45,USA,2019,6,10,18
517,"InthemoshpitofaMetallicaconcert,thethunderouschordscreateasymphonyofheadbangingecstasy.",Ecstasy,3/20/2023 22:30,MetallicaMoshWarrior,Facebook, #Ecstasy #MetallicaConcert,35,70,USA,2023,3,20,22
518,"ExperiencingthemagicofaColdplayconcert,where'FixYou'becomesabeaconofhopeinthenight.",Hope,11/28/2016 19:00,ColdplayHopeSeeker,Instagram, #Hope #ColdplayMagic,30,60,UK,2016,11,28,19
519,"AtaJustinBieberconcert,theinfectiousbeatsof'Baby'createadancefloorofunbridledenthusiasm.",Enthusiasm,8/5/2018 20:00,BieberDanceEnthusiast,Instagram, #Enthusiasm #JustinBieber,40,80,Canada,2018,8,5,20
520,"InthespotlightataLadyGagashow,eachcostumechangeisametamorphosisofcreativityandartistry.",Creativity,4/15/2021 21:30,GagaArtisticChameleon,Twitter, #Creativity #LadyGaga,35,70,USA,2021,4,15,21
521,"ImmersedinthesoulfulmelodiesofAdele,tearsflowfreely,movedbytheemotionof'Hello'.",Emotion,11/28/2019 19:45,AdeleMelodyTearjerker,Facebook, #Emotion #AdeleMelodies,30,60,UK,2019,11,28,19
522,"DrenchedinconfettiataKatyPerryconcert,akaleidoscopeofcolorsignitingthenightsky.",Colorful,6/22/2020 22:00,KatyPerryColorExplosion,Instagram, #Colorful #KatyPerry,22,45,USA,2020,6,22,22
523,"IntheaudienceofaJay-Zperformance,thelyricsof'EmpireStateofMind'becomeananthemofpride.",Pride,9/10/2017 20:15,JayZEmpireListener,Twitter, #Pride #JayZAnthem,18,35,USA,2017,9,10,20
524,"DancingtoShakira'srhythmicbeats,hipsswayingtothehypnoticcharmof'HipsDon'tLie'.",Hypnotic,2/28/2022 21:15,ShakiraHipsDancer,Facebook, #Hypnotic #ShakiraRhythms,28,55,Colombia,2022,2,28,21
525,"AtaU2concert,theanthemicchordsof'WithorWithoutYou'createatimelessmomentofconnection.",Connection,5/15/2016 19:30,U2ConnectionSeeker,Instagram, #Connection #U2Anthem,25,50,Ireland,2016,5,15,19
526,"RockingoutataGunsN'Rosesshow,theiconicriffsof'SweetChildo'Mine'echoinginthenight.",Iconic,12/10/2018 22:30,GunsNRosesRiffRockstar,Twitter, #Iconic #GNRConcert,22,45,USA,2018,12,10,22
527,"InthecrowdofanArianaGrandeconcert,thehighnotesof'IntoYou'createaeuphoricsymphony.",Euphoria,1/22/2023 20:00,ArianaEuphoriaChaser,Facebook, #Euphoria #ArianaGrande,35,70,USA,2023,1,22,20
528,"SwayingtothereggaevibesofBobMarley'stributeconcert,eachchordajourneytoJamaica'ssoul.",Journey,3/5/2020 18:45,MarleyReggaeTraveler,Instagram, #Journey #BobMarleyTribute,30,60,Jamaica,2020,3,5,18
529,"Captivatedbythespellbindingplottwists,theaudienceapplauds,experiencingarollercoasterofemotionsatthemoviepremiere.",Excitement,10/12/2018 20:00,MovieEnthusiastPremiereAttendee,Twitter, #Excitement #MoviePremiereThrills,40,80,USA,2018,10,12,20
530,"Asthecreditsroll,aprofoundsenseofnostalgiawashesover,reminiscentofcherishedmomentsinclassicfilms.",Nostalgia,6/25/2019 22:15,FilmLoverNostalgiaSeeker,Instagram, #Nostalgia #ClassicFilmMoments,35,70,UK,2019,6,25,22
531,"Streamingthelatestwebseries,theviewerisengrossedinthecharacters'journey,feelingasenseofconnectionandempathy.",Engagement,7/8/2020 19:30,WebSeriesViewerCharacterConnection,Facebook, #Engagement #WebSeriesJourney,30,60,Canada,2020,7,8,19
532,"Atthefilmfestival,theindiefilmmaker'screationreceivesastandingovation,evokingprideandasenseofaccomplishment.",Pride,9/18/2017 21:45,IndieFilmmakerFestivalSuccess,Twitter, #Pride #IndieFilmSuccess,22,45,Australia,2017,9,18,21
533,"Watchingaheartwarmingfamilydrama,tearsflowfreelyasthecharactersovercomechallenges,leavingtheviewerwithawarmglow.",Touched,1/15/2021 18:00,DramaEnthusiastHeartwarmingMoments,Instagram, #Touched #FamilyDramaMoments,28,55,India,2021,1,15,18
534,"AttheOscars,theactorgraciouslyacceptsanaward,radiatingjoyandgratitudefortherecognitionoftheiroutstandingperformance.",Gratitude,2/28/2016 20:30,AwardWinningActorOscarsRecipient,Facebook, #Gratitude #OscarWinningMoment,18,35,USA,2016,2,28,20
535,"Discoveringahiddengemintheworldofdocumentaries,theviewerisenlightenedandinspired,feelingarenewedsenseofcuriosity.",Inspiration,4/20/2022 17:30,DocumentaryEnthusiastHiddenGemFinder,Twitter, #Inspiration #HiddenGemDiscovery,22,45,France,2022,4,20,17
536,"Asthemoviecreditsroll,theviewerexperiencesamixofaweandcontemplation,ponderingthedeepermeaningswovenintothestoryline.",Contemplation,11/5/2019 21:15,FilmBuffContemplativeViewer,Instagram, #Contemplation #DeepMeanings,28,55,Germany,2019,11,5,21
537,"Binge-watchingathrillingcrimeseries,thesuspensekeepstheviewerontheedgeoftheirseat,creatingarushofadrenaline.",Suspense,7/12/2015 22:00,CrimeSeriesEnthusiastThrillSeeker,Facebook, #Suspense #CrimeSeriesThrills,35,70,Japan,2015,7,12,22
538,"Astheclosingsceneunfolds,asenseofsatisfactionwashesover,completingthecinematicjourneywithaprofoundandfulfillingending.",Satisfaction,9/10/2020 19:45,FilmCriticSatisfactionSeeker,Twitter, #Satisfaction #FulfillingEnding,22,45,Brazil,2020,9,10,19
539,"CelebratingahistoricvictoryintheWorldCup,thenationeruptsinjoy,unitedbythetriumphoftheirfootballteam.",Joy,7/15/2018 21:30,FootballFanWorldCupCelebration,Instagram, #Joy #WorldCupTriumph,40,80,Brazil,2018,7,15,21
540,"AttheOlympics,theathlete'sperseveranceshinesthrough,earningagoldmedalandinspiringagenerationwiththeirremarkableachievement.",Inspiration,8/8/2020 19:45,OlympicsEnthusiastGoldMedalWinner,Twitter, #Inspiration #OlympicAchievement,35,70,USA,2020,8,8,19
541,"Inthecricketchampionship,anail-bitingfinishleavesfansontheedgeoftheirseats,experiencingarollercoasterofemotions.",Excitement,6/25/2019 22:15,CricketFanChampionshipThrills,Facebook, #Excitement #CricketChampionship,30,60,India,2019,6,25,22
542,"Witnessingarecord-breakingmarathon,spectatorsarefilledwithaweandadmirationfortheenduranceanddedicationoftherunners.",Admiration,11/7/2021 17:30,MarathonSpectatorRecordBreaking,Instagram, #Admiration #MarathonRecords,22,45,Kenya,2021,11,7,17
543,"Inthetennisgrandslam,afiercerivalryunfolds,captivatingfanswithadisplayofskillandsportsmanshipontheworldstage.",Captivation,9/10/2017 20:15,TennisEnthusiastGrandSlamDrama,Twitter, #Captivation #TennisRivalry,28,55,UK,2017,9,10,20
544,"Cheeringfortheunderdoginthebasketballfinals,thecrowderuptsinapplauseastheteamdefiesoddstoclaimthechampionshiptitle.",Triumph,6/20/2022 21:00,BasketballFanUnderdogTriumph,Facebook, #Triumph #BasketballFinals,18,35,USA,2022,6,20,21
545,"Atthegolftournament,thegolfer'sprecisionandfocusleadtoastunningvictory,leavingspectatorsinaweoftheirexceptionalskill.",Awe,4/10/2016 18:30,GolfEnthusiastPrecisionVictory,Instagram, #Awe #GolfVictory,22,45,Scotland,2016,4,10,18
546,"Experiencingthethrillofahigh-speedFormula1race,fansareontheedgeoftheirseatsasdriverscompeteforthechampionship.",Thrill,11/24/2019 19:45,F1FanHighSpeedRaceExcitement,Twitter, #Thrill #Formula1Championship,28,55,Germany,2019,11,24,19
547,"Inthecyclingworldchampionship,theclimberconquerschallengingterrains,symbolizingdeterminationandachievementagainstallodds.",Determination,9/28/2015 22:30,CyclingEnthusiastWorldChampion,Facebook, #Determination #CyclingChampion,35,70,Italy,2015,9,28,22
548,"Witnessingaheartwarmingcomebackinthehockeyfinals,fanssharetearsofjoyastheteamsecuresahistoricvictoryafteradversity.",Heartwarming,12/12/2020 20:00,HockeyFanComebackVictory,Instagram, #Heartwarming #HockeyFinalsComeback,22,45,Canada,2020,12,12,20
549,"Afteraseriesofdefeats,thesoccerteamfacesdisappointment,strugglingtofindthesilverlininginachallengingseason.",Disappointment,11/2/2019 18:45,SoccerFanTeamDefeats,Twitter, #Disappointment #SoccerDefeats,40,80,Brazil,2019,11,2,18
550,"Inthetennistournament,ahighlyanticipatedplayerexperiencesasetback,leavingfansinshockandquestioningtheunforeseenturnofevents.",Frustration,7/10/2018 21:15,TennisEnthusiastUnexpectedSetback,Instagram, #Frustration #TennisSetback,35,70,USA,2018,7,10,21
551,"Facingadefeatinthechampionship,theboxerreflectsonthechallenges,vowingtoreturnstrongerandmoredeterminedinthenextbout.",Reflection,9/18/2020 19:30,BoxingFanChampionshipDefeat,Facebook, #Reflection #BoxingDefeat,30,60,UK,2020,9,18,19
552,"Inthemidstofacyclingrace,atireblowoutleadstofrustrationforthecyclist,whovaliantlytriestoovercometheunexpectedobstacle.",Obstacle,5/15/2017 22:00,CyclingEnthusiastTireBlowout,Twitter, #Obstacle #CyclingFrustration,22,45,France,2017,5,15,22
553,"Thegymnast'sunexpectedfallduringaroutinesparksawaveofsympathyfromtheaudience,highlightingthevulnerabilityofsports.",Sympathy,4/5/2021 20:15,GymnasticsFanRoutineFall,Instagram, #Sympathy #GymnasticsFall,28,55,Japan,2021,4,5,20
554,"Inthegolftournament,amissedcrucialputtresultsindefeat,causingthegolfertoreflectonthepressureofhigh-stakescompetition.",Pressure,8/20/2016 18:30,GolfEnthusiastMissedPutt,Facebook, #Pressure #GolfDefeat,18,35,USA,2016,8,20,18
555,"Experiencingaseriesoflossesinthebasketballseason,theteamgrappleswithfrustration,determinedtoturnthetidewithrenewedeffort.",RenewedEffort,2/12/2019 19:45,BasketballFanTeamLosses,Twitter, #RenewedEffort #BasketballStruggles,22,45,Canada,2019,2,12,19
556,"Despitemeticuloustraining,theswimmerfacesdisappointmentasasplit-secondmiscalculationcoststhemtheleadinacrucialrace.",Miscalculation,6/28/2015 20:00,SwimmingEnthusiastRaceSetback,Instagram, #Miscalculation #SwimmingDisappointment,28,55,Australia,2015,6,28,20
557,"Theweightlifter'sfailedattemptatapersonalrecordresultsinfrustration,highlightingthechallengingnatureofpushingphysicallimits.",Challenge,1/8/2022 21:30,WeightliftingFanFailedRecord,Facebook, #Challenge #WeightliftingFailure,35,70,Germany,2022,1,8,21
558,"Inthemidstofasoccermatch,anunexpectedowngoalcreatesamomentofdespairfortheplayer,asteammatesconsoleandencouragethem.",Despair,12/15/2018 20:15,SoccerPlayerOwnGoalMoment,Twitter, #Despair #OwnGoal,22,45,Spain,2018,12,15,20
559,"Intheserenebeautyofasunset,natureunfoldsacanvasofcolors,evokingasenseoftranquilityandwonder.",Tranquility,7/10/2021 19:00,NatureEnthusiastSunsetWonder,Instagram, #Tranquility #SunsetBeauty,40,80,Canada,2021,7,10,19
560,"Embarkingonaspontaneousroadtrip,thetravelerdiscovershiddengems,creatingmemoriesthatwillbecherishedforalifetime.",Adventure,9/28/2019 20:30,TravelEnthusiastRoadTripDiscovery,Twitter, #Adventure #RoadTripMemories,35,70,USA,2019,9,28,20
561,"Amidstthebustlingcity,aquietcafbecomesasanctuaryforreflection,whereacupofcoffeebringssolacetothewanderingmind.",Solace,3/15/2022 18:45,UrbanExplorerCafeSolitude,Facebook, #Solace #CafeReflection,30,60,France,2022,3,15,18
562,"Exploringthevibrantstreetartofaculturalneighborhood,eachmuraltellsastory,infusingthecitywithcreativityandexpression.",Creativity,11/5/2017 21:15,ArtEnthusiastStreetArtExploration,Instagram, #Creativity #StreetArtVibes,22,45,Brazil,2017,11,5,21
563,"Intheworldofscience,abreakthroughdiscoveryunfolds,pushingtheboundariesofknowledgeandopeningnewfrontiersofexploration.",Breakthrough,5/20/2020 16:30,ScienceEnthusiastDiscoveryMoment,Twitter, #Breakthrough #ScientificDiscovery,28,55,Germany,2020,5,20,16
564,"Connectingwiththemelodyofaliveorchestra,themusicenthusiastexperiencesasymphonythatresonatesdeepwithinthesoul.",Harmony,8/22/2016 19:45,MusicLoverLiveOrchestraExperience,Facebook, #Harmony #OrchestraMelody,18,35,UK,2016,8,22,19
565,"Embracingthearomaoffreshlybakedbread,thehomecheffindsjoyintheartofbaking,creatingdeliciousmemoriesforlovedones.",JoyinBaking,4/10/2023 17:15,HomeBakerDeliciousMemories,Instagram, #JoyInBaking #HomemadeDelights,22,45,India,2023,4,10,17
566,"Wanderingthroughahistoricalmuseum,thehistoryenthusiastbecomesimmersedinthetalesofthepast,envisioningbygoneeras.",EnvisioningHistory,12/18/2015 18:00,HistoryBuffMuseumExploration,Twitter, #EnvisioningHistory #MuseumTales,28,55,Italy,2015,12,18,18
567,"Intherealmofliterature,acaptivatingnoveltransportsthereadertodistantlands,weavingatapestryofimaginationandescape.",Imagination,10/8/2021 20:30,BookwormCaptivatingNovelEscape,Facebook, #Imagination #LiteraryEscape,35,70,Japan,2021,10,8,20
568,"Capturingtheessenceofabustlingmarket,thephotographerfreezesmomentsintime,eachframetellingauniqueandvibrantstory.",Vibrancy,3/22/2019 21:45,PhotographyEnthusiastMarketMoments,Instagram, #Vibrancy #MarketStories,22,45,Australia,2019,3,22,21
569,"Underneaththecitylights,thedancerexpressesemotionsthroughgracefulmovements,creatingamesmerizingperformanceunderthenightsky.",Mesmerizing,6/15/2018 22:00,DanceEnthusiastCityNightPerformance,Twitter, #Mesmerizing #NightDancePerformance,40,80,USA,2018,6,15,22
570,"Intheheartofabustlingmarket,thestreetfoodconnoisseurindulgesinaculinaryadventure,savoringdiverseflavorsandaromas.",CulinaryAdventure,8/28/2019 19:30,FoodieMarketStreetFoodExploration,Instagram, #CulinaryAdventure #StreetFoodDelights,35,70,Thailand,2019,8,28,19
571,"Asthefirstsnowflakedescends,thewinterenthusiasteagerlypreparesforaseasonoffrostydelights,anticipatingthemagicofsnow-coveredlandscapes.",WinterMagic,12/1/2022 17:45,SnowLoverWinterEnthusiast,Facebook, #WinterMagic #SnowyLandscapes,30,60,Canada,2022,12,1,17
572,"Amidstthepagesofacaptivatingmysterynovel,thereaderunravelscluesandsecrets,experiencingathrillingjourneyofsuspenseandrevelation.",ThrillingJourney,4/10/2017 21:15,MysteryBookwormSuspensefulRead,Twitter, #ThrillingJourney #MysteryNovel,22,45,UK,2017,4,10,21
573,"Surroundedbythevibrantcolorsofaflowergarden,thegardenernurturesblossoms,findingjoyinthebeautyofnature'sever-changingcanvas.",Nature'sBeauty,5/15/2020 18:30,GardeningEnthusiastFlowerGarden,Instagram, #NaturesBeauty #FloralJoy,28,55,Australia,2020,5,15,18
574,"Attheastronomyobservatory,thestargazermarvelsatthevastnessofthecosmos,contemplatingthemysterieshiddenwithinthecelestialexpanse.",CelestialWonder,9/22/2016 20:00,AstronomyEnthusiastStargazing,Facebook, #CelestialWonder #Stargazing,18,35,USA,2016,9,22,20
575,"Engulfedinthearomaoffreshlybrewedcoffee,thewriterfindsinspirationineverysip,embarkingonajourneyofcreativityandprose.",CreativeInspiration,2/12/2023 19:45,CoffeeLoverWritersRetreat,Twitter, #CreativeInspiration #CoffeeJourney,22,45,France,2023,2,12,19
576,"Intherealmoffashion,thedesignerunveilsacollectionthattellsastory,blendinginnovationandtraditionontherunwayofcreativity.",RunwayCreativity,11/10/2015 21:00,FashionEnthusiastDesignerShowcase,Instagram, #RunwayCreativity #FashionInnovation,28,55,Italy,2015,11,10,21
577,"Asthewavescrashagainsttheshore,thesurferembracesthethrillofridingtheocean'senergy,capturingtheessenceoffreedomineachwave.",Ocean'sFreedom,7/20/2021 18:15,SurfingEnthusiastWaveRider,Facebook, #OceansFreedom #SurfingThrills,22,45,Brazil,2021,7,20,18
578,"Exploringthehistoricalarchitectureofanancientcity,thetraveleristransportedtoabygoneera,whereeachmonumentwhisperstalesofthepast.",WhispersofthePast,4/18/2019 20:30,HistoryExplorerAncientCityTour,Twitter, #WhispersOfThePast #HistoricalTour,35,70,Greece,2019,4,18,20
579,Successfullyavoidedeyecontactwithmycrushinthehallway.Missionaccomplished.#TeenCrush#StealthMode,Excitement,5/20/2023 19:45,CrushAvoider,Twitter, #CrushStruggles #AvoidingEyeContact,15,30,USA,2023,5,20,19
580,Ranoutofsnacksduringamoviemarathon.Crisislevel:Emergency!#MovieNightStruggles#TeenProblems,Boredom,5/21/2023 21:00,MovieBuff,Instagram, #SnackCrisis #TeenLife,18,35,Canada,2023,5,21,21
581,Spentanhourchoosingtheperfectfilterforaselfie.ThestruggleforthatInstagramaestheticisreal.#SelfieQueen#TeenVibes,Joy,5/22/2023 14:30,SelfieAddict,Facebook, #SelfieStruggle #TeenConfessions,22,45,UK,2023,5,22,14
582,Lostmyheadphonesagain.Howdotheyvanishintothinair?#HeadphoneMystery#TeenLife,Frustration,5/23/2023 16:45,AudioExplorer,Twitter, #TeenProblems #LostHeadphones,20,40,USA,2023,5,23,16
583,Decidedtostudyforexamsbutendedupmakingmemesaboutstudyinginstead.Procrastinationlevel:Expert.#ProcrastinationNation#TeenConfessions,Surprise,5/24/2023 13:15,MemeCreator,Instagram, #StudyingMemes #TeenLife,25,50,Canada,2023,5,24,13
584,"Gotdressedfortheday,thenrememberedit'sSaturday.Oops.#WeekendVibes#TeenStruggles",Indifference,5/25/2023 19:00,FashionBlunder,Facebook, #WeekendOops #TeenFashion,20,40,USA,2023,5,25,19
585,Survivedagroupprojectwithoutanydrama.Miraclesdohappen.#GroupProjectSuccess#TeenAchievements,Satisfaction,5/26/2023 14:20,GroupGenius,Twitter, #TeenSuccess #ProjectMiracle,28,55,UK,2023,5,26,14
586,"Enteredthekitchenwiththeintentiontocook.Leftwithabagofchips.Cookingisoverrated,anyway.#MasterChefInTraining#TeenHumor",Disgust,5/27/2023 21:15,ChipExplorer,Instagram, #TeenChef #CookingFail,22,45,Canada,2023,5,27,21
587,"Staringattheclockinclass,waitingforthebelltoringlikeit'sthemostexcitingeventoftheday.#ClassCountdown#TeenLife",Surprise,5/28/2023 12:00,ExcitementSeeker,Facebook, #ClassEvent #TeenExcitement,18,35,USA,2023,5,28,12
588,"Discoveredanewbookseriesandspentthewholenightreading.Whoneedssleep,anyway?#BookwormLife#LateNightReading",Joy,5/29/2023 23:30,NightReader,Twitter, #BookDiscoveries #TeenReading,30,60,UK,2023,5,29,23
589,"Boughtanewvideogame,playedforhours,forgottoeat.Theultimategamingsession.#GamerLife#NoFoodGaming",Excitement,5/30/2023 20:45,GamingEnthusiast,Instagram, #GameOn #TeenGamer,22,45,USA,2023,5,30,20
590,Spentthedaybinge-watchinganewseries.Productivitylevel:Zero.#LazyDay#TVSeriesMarathon,Joy,5/31/2023 15:30,LazyWatcher,Facebook, #BingeWatchDay #TeenLife,35,70,Canada,2023,5,31,15
591,Caughtuponthelatestfashiontrendsandnowplanningashoppingspree.#Fashionista#TrendyTeen,Excitement,6/1/2023 18:00,TrendExplorer,Twitter, #FashionGoals #TeenStyle,20,40,USA,2023,6,1,18
592,Decidedtolearnanewinstrument.Dayone:Stilltryingtofigureouthowtoholdit.#MusicNovice#LearningJourney,Frustration,6/2/2023 14:30,MusicalExplorer,Instagram, #InstrumentLearning #TeenMusic,28,55,UK,2023,6,2,14
593,Spenthourscreatingtheperfectplaylistforeverymood.Musicismytherapy.#PlaylistMaker#TeenMusicLover,Joy,6/3/2023 21:15,MusicAficionado,Facebook, #MusicTherapy #TeenPlaylist,22,45,Canada,2023,6,3,21
594,Successfullycookedagourmetmealforthefamily.Chefskillsunlocked!#ChefMode#TeenChef,Pride,6/4/2023 19:30,HomeChef,Twitter, #CookingSuccess #TeenCook,25,50,USA,2023,6,4,19
595,Spontaneouslybookedaweekendgetaway.Adventureawaits!#TravelBug#WeekendEscape,Excitement,6/5/2023 10:00,AdventureSeeker,Instagram, #GetawayGoals #TeenTravel,18,35,UK,2023,6,5,10
596,Attendedaconcertanddancedthenightaway.Musicistheheartbeatoflife.#ConcertVibes#DanceAllNight,Joy,6/6/2023 22:30,DanceEnthusiast,Facebook, #MusicMagic #TeenConcert,28,55,Canada,2023,6,6,22
597,Rediscoveredchildhoodcartoonsandhadanostalgia-filledmarathon.#CartoonNostalgia#TeenMemories,Joy,6/7/2023 12:45,NostalgiaExplorer,Twitter, #ChildhoodMemories #TeenCartoons,22,45,USA,2023,6,7,12
598,EmbarkedonaDIYhomedecorproject.Let'shopeitturnsoutbetterthanlasttime.#DIYAdventure#TeenHomeDecor,Excitement,6/8/2023 16:00,HomeDecorator,Instagram, #DIYGoals #TeenCreative,35,70,UK,2023,6,8,16
599,"Spenttheafternoonatamuseum,pretendingtobecultured.Artenthusiastinthemaking.#MuseumDay#TeenArtLover",Curiosity,6/9/2023 14:00,ArtExplorer,Facebook, #CulturalDay #TeenCuriosity,20,40,USA,2023,6,9,14
600,Startedablogaboutrandomthoughtsandmusings.Bloggingisthenewdiary.#BloggerLife#TeenBlogger,Curiosity,6/10/2023 17:30,ThoughtfulBlogger,Twitter, #BloggingJourney #TeenThoughts,30,60,Canada,2023,6,10,17
601,Relishingapeacefulafternoonwithaclassicnovel.Quietmomentsarethebestmoments.#BookLover#PeacefulAfternoon,Contentment,6/11/2023 15:30,NovelEnthusiast,Instagram, #QuietMoments #BookishEscape,35,70,USA,2023,6,11,15
602,"Reflectingonalifetimeofmemories,eachwrinkletellsastory.Embracingthebeautyofaging.#LifeReflections#BeautyInAging",Gratitude,6/12/2023 18:00,WiseSoul,Twitter, #AgingGracefully #Memories,28,55,UK,2023,6,12,18
603,Exploringtheworldofdigitalart.It'snevertoolatetodiscovernewpassions.#DigitalArtistry#LateBloomer,Curiosity,6/13/2023 14:45,ArtAdventurer,Facebook, #ArtDiscovery #SeniorArtist,22,45,Canada,2023,6,13,14
604,Savoringtheflavorsofahome-cookedmeal.Simplejoysaretheheartofhappiness.#HomeCooking#SimpleJoys,Contentment,6/14/2023 19:30,HomeChefSenior,Instagram, #HappinessInFood #SeniorLife,25,50,USA,2023,6,14,19
605,Embarkingonajourneyoflearninganewlanguage.Themindstaysyoungwitheverynewword.#LanguageLearning#NeverTooLate,Curiosity,6/15/2023 12:15,LinguisticExplorer,Twitter, #MindEnrichment #SeniorLearning,30,60,UK,2023,6,15,12
606,"Attendedaclassicalmusicconcert,feelingthetimelessmelodiesresonate.Musictranscendsgenerations.#ClassicalMusic#TimelessMelodies",Joy,6/16/2023 21:45,MusicConnoisseur,Facebook, #MusicLover #SeniorConcert,18,35,Canada,2023,6,16,21
607,Capturingthebeautyofnaturethroughphotography.Everysnapshotisatreasure.#NaturePhotography#SeniorPhotographer,Joy,6/17/2023 15:00,PhotographySenior,Instagram, #NatureCapture #SeniorMoments,35,70,USA,2023,6,17,15
608,"Reconnectingwitholdfriendsoveracupoftea.Friendship,thetrueessenceofcompanionship.#OldFriends#Companionship",Contentment,6/18/2023 11:30,TeaTimeSenior,Twitter, #FriendshipGoals #SeniorBonding,28,55,UK,2023,6,18,11
609,"Embarkedonaroadtriptorevisitcherishedplacesfromthepast.Nostalgia,theultimatetravelcompanion.#RoadTrip#NostalgiaTour",Joy,6/19/2023 16:30,RoadTripSenior,Facebook, #CherishedPlaces #SeniorTravel,22,45,Canada,2023,6,19,16
610,"Joinedacommunitychoir,harmonizingwithfellowvoices.Musiccreatesbondsthatwithstandtime.#CommunityChoir#HarmonyInAging",Joy,6/20/2023 14:20,ChoirEnthusiast,Instagram, #MusicHarmony #SeniorVoices,20,40,USA,2023,6,20,14
611,"Exploringtheartofmeditation,findingtranquilityinthestillnessofthemind.#MeditationJourney#TranquilMind",Contentment,6/21/2023 19:00,MeditationSenior,Twitter, #MindfulLiving #SeniorCalm,18,35,UK,2023,6,21,19
612,"Takingastrollinthegarden,appreciatingthebeautyofbloomingflowers.Nature'swondersnevercease.#GardenWalk#FloralBeauty",Contentment,6/22/2023 13:45,GardenEnthusiast,Facebook, #NatureWonders #SeniorGarden,25,50,USA,2023,6,22,13
613,"Sippingonafavoritevintagewine,eachsiptellingastoryoftheyearsgoneby.Cheerstoalifewell-lived.#WineLover#VintageCheers",Contentment,6/23/2023 18:45,WineConnoisseur,Instagram, #LifeWellLived #SeniorWine,28,55,UK,2023,6,23,18
614,"Participatedinacommunityartclass,unleashingcreativityinthegoldenyears.Arthasnoagelimit.#ArtClass#SeniorArtistry",Joy,6/24/2023 16:15,ArtisticSenior,Twitter, #CreativityAtAnyAge #SeniorCreativity,22,45,Canada,2023,6,24,16
615,"Embarkingonajourneyofwritingamemoir,documentingalifetimeofexperiences.Everystorymatters.#MemoirWriting#SeniorStories",Gratitude,6/25/2023 20:30,MemoiristSenior,Facebook, #LifetimeExperiences #SeniorMemoir,35,70,USA,2023,6,25,20
616,"Attendedalectureonhistory,alwaysfascinatedbythelessonsfromthepast.Learningisalifelongadventure.#HistoryLecture#SeniorLearning",Curiosity,6/26/2023 14:00,HistoryEnthusiast,Instagram, #LifetimeAdventure #SeniorCuriosity,30,60,UK,2023,6,26,14
617,"Rediscoveredthejoyofcookingtraditionalfamilyrecipes.Thekitchen,aplaceofcherishedmemories.#FamilyRecipes#SeniorCooking",Contentment,6/27/2023 17:45,FamilyChefSenior,Twitter, #KitchenMemories #SeniorCulinary,20,40,USA,2023,6,27,17
618,"Joinedanaturephotographyclub,capturingthebeautyofthegreatoutdoors.Everyclickisaconnectiontonature.#NaturePhotography#SeniorPhotographer",Joy,6/28/2023 22:15,NaturePhotographySenior,Facebook, #OutdoorBeauty #SeniorClicks,18,35,UK,2023,6,28,22
619,"Attendedajazzconcertandswayedtotherhythmoftimelesstunes.Music,aconstantcompanioninthegoldenyears.#JazzConcert#SeniorMusic",Joy,6/29/2023 16:30,JazzMusicLover,Instagram, #TimelessTunes #SeniorJazz,25,50,USA,2023,6,29,16
620,"Joinedawritinggroup,penningdownthoughtsandreflections.Writing,ajourneyintothedepthsofthesoul.#WritingGroup#SeniorWriter",Gratitude,6/30/2023 19:30,SeniorWordsmith,Twitter, #SoulfulWriting #SeniorReflections,28,55,UK,2023,6,30,19
621,"Embarkedonasolotraveladventure,discoveringthebeautyofnewplacesatmyownpace.#SoloTravel#SeniorExplorer",Excitement,7/1/2023 14:00,SoloAdventurer,Instagram, #DiscoverNewPlaces #SeniorTravel,30,60,USA,2023,7,1,14
622,"Attendedavintagecarshow,reminiscingabouttheclassicsthatonceruledtheroads.Nostalgiaineveryrev.#VintageCars#ClassicRides",Joy,7/2/2023 18:30,CarEnthusiastSenior,Facebook, #RoadTripDownMemoryLane #SeniorCars,22,45,UK,2023,7,2,18
623,"Startedacommunitygarden,growingnotjustplantsbutfriendshipstoo.Greenthumbsunite!#CommunityGarden#SeniorGardener",Joy,7/3/2023 12:45,GreenThumbSenior,Twitter, #GardenFriends #SeniorGreenThumb,28,55,Canada,2023,7,3,12
624,"Hostedafamilydinner,wherelaughterechoedlouderthantheclinkingofutensils.Family,theheartofhappiness.#FamilyDinner#SeniorHost",Contentment,7/4/2023 17:00,FamilyHostSenior,Instagram, #HeartwarmingMoments #SeniorFamily,35,70,USA,2023,7,4,17
625,"Enrolledinadanceclassforseniors,movingtotherhythmoflife.Ageisjustanumberonthedancefloor.#DanceClass#SeniorDancer",Joy,7/5/2023 20:15,DanceEnthusiastSenior,Twitter, #DanceLife #SeniorMoves,18,35,UK,2023,7,5,20
626,"Visitedanartgallery,appreciatingthebrushstrokesthattelltalesofcreativity.Art,aneternalcompanion.#ArtGallery#SeniorArtLover",Joy,7/6/2023 14:30,ArtGalleryVisitor,Facebook, #CreativeExpressions #SeniorArt,25,50,USA,2023,7,6,14
627,"Startedabookclubforseniors,wherediscussionsareaslivelyasthecharactersinthenovels.#BookClub#SeniorReaders",Joy,7/7/2023 19:45,SeniorBookClub,Instagram, #BookishTalks #SeniorBookworms,22,45,UK,2023,7,7,19
628,"Hostedapicnicinthepark,baskinginthewarmthoffriendshipandsunshine.Simplejoys,timelessmemories.#ParkPicnic#SeniorJoy",Contentment,7/8/2023 16:00,SeniorPicnicHost,Twitter, #FriendshipSunshine #SeniorMemories,30,60,Canada,2023,7,8,16
629,"Participatedinalocaltheaterproduction,provingthatthestagebelongstoeveryage.#TheaterProduction#SeniorActor",Joy,7/9/2023 22:30,SeniorActor,Facebook, #StagePassion #SeniorTheater,20,40,USA,2023,7,9,22
630,"Embarkedonahikingadventure,conqueringtrailsandrelishingthebeautyofnature.Ageisjustanumberonthemountaintop.#HikingAdventure#SeniorHiker",Excitement,7/10/2023 14:20,SeniorHikerExplorer,Instagram, #NatureTrailBlazer #SeniorExplorer,28,55,UK,2023,7,10,14
631,Hostedaphotographyexhibitionfeaturingsnapshotsofalifewell-lived.Everyphotohasastorytotell.#PhotographyExhibition#SeniorPhotographer,Gratitude,7/11/2023 18:45,SeniorPhotographerExhibitor,Twitter, #LifeInPictures #SeniorExhibition,22,45,Canada,2023,7,11,18
632,"Joinedaseniors'cyclingclub,feelingthewindinmyhairandthefreedomoftheopenroad.#CyclingClub#SeniorCyclist",Excitement,7/12/2023 13:45,SeniorCyclingEnthusiast,Facebook, #OpenRoadAdventures #SeniorCycling,25,50,USA,2023,7,12,13
633,"Attendedawinetastingevent,savoringtherichnessofflavorsthatagelikefinewine.Cheerstothegoldenyears!#WineTasting#SeniorWineLover",Joy,7/13/2023 20:00,SeniorWineConnoisseur,Instagram, #AgedToPerfection #SeniorCheers,35,70,UK,2023,7,13,20
634,"Startedlearningballroomdancing,glidinggracefullyacrossthedancefloor.Agelesseleganceineverystep.#BallroomDancing#SeniorDancer",Joy,7/14/2023 16:15,SeniorBallroomDancer,Twitter, #GracefulMoves #SeniorDance,20,40,USA,2023,7,14,16
635,"Organizedacommunitypaintingevent,turningblankcanvasesintoamasterpieceofsharedcreativity.#PaintingEvent#SeniorArtist",Joy,7/15/2023 19:30,SeniorPaintingOrganizer,Facebook, #CommunityArt #SeniorCreativity,28,55,Canada,2023,7,15,19
636,"Hosteda'memorylane'eveningwitholdfriends,reminiscingabouttheadventuresthatshapedourlives.#MemoryLane#SeniorReminiscing",Gratitude,7/16/2023 14:00,SeniorMemoriesHost,Instagram, #FriendshipAdventures #SeniorNostalgia,30,60,USA,2023,7,16,14
637,"Joinedaseniors'astronomyclub,stargazingandfindingwonderinthevastnessofthecosmos.#AstronomyClub#SeniorStargazer",Curiosity,7/17/2023 22:15,SeniorStargazer,Twitter, #CelestialWonders #SeniorAstronomy,18,35,UK,2023,7,17,22
638,"Attendedalocaljazzfestival,tappingtoestothetunesthathavestoodthetestoftime.Music,alifelongloveaffair.#JazzFestival#SeniorMusicLover",Joy,7/18/2023 16:30,SeniorJazzFestivalGoer,Facebook, #TimelessTunes #SeniorJazz,25,50,USA,2023,7,18,16
639,"Startedablogsharingthewisdomgainedthroughtheyears,provingthateverydayisachancetolearnandgrow.#SeniorWisdom#Blog",Gratitude,7/19/2023 19:45,WisdomBloggerSenior,Instagram, #LifeLessons #SeniorBlog,22,45,UK,2023,7,19,19
640,"Participatedinacharityrun,provingthatageisnobarriertosupportingmeaningfulcauses.#CharityRun#SeniorRunner",Excitement,7/20/2023 17:00,SeniorCharityRunner,Twitter, #RunForACause #SeniorSupport,30,60,Canada,2023,7,20,17
641,"Survivedachallengingphysicsexam.Equations,youwon'tdefeatme!",Relief,8/1/2023 13:30,PhysicsWhizHighSchool,Instagram, #PhysicsSurvivor #HighSchoolAdventures,20,40,USA,2023,8,1,13
642,Exploringtheworldofcoding.Debuggingisanadventureonitsown!#CodingJourney#HighSchoolCoder,Excitement,8/2/2023 14:45,CodeExplorerHighSchool,Twitter, #CodingAdventure #HighSchoolCoderLife,25,50,UK,2023,8,2,14
643,"Joinedtheschooldebateteam.Wordsaremyweapons,andI'mreadyforbattle!",Excitement,8/3/2023 12:15,DebateWarriorHighSchool,Facebook, #DebateWarrior #HighSchoolDebater,18,35,Canada,2023,8,3,12
644,"Startedaphotographyclubatschool.Capturingmoments,onesnapshotatatime!",Joy,8/4/2023 16:30,PhotoClubHighSchool,Instagram, #PhotographyClub #HighSchoolPhotographer,22,45,USA,2023,8,4,16
645,"Daydreamingabouttheupcomingprom.Thedress,thedanceit'safairytaleinthemaking!",Excitement,8/5/2023 19:45,PromDreamerHighSchool,Twitter, #PromDreams #HighSchoolFairytale,30,60,Canada,2023,8,5,19
646,Convincedtheteachertohaveclassoutdoors.Learningequationswithasideoffreshair!,Positive,8/6/2023 14:00,OutdoorClassHighSchool,Facebook, #OutdoorClassroom #HighSchoolExplorer,28,55,USA,2023,8,6,14
647,"Accidentallyspilledpaintinartclass.Abstractart,right?#ArtClassAdventures#HighSchoolArtist",Embarrassed,8/7/2023 19:45,PaintSpillHighSchool,Instagram, #ArtisticMishaps #HighSchoolArt,22,45,UK,2023,8,7,19
648,Tryingtomastertheperfectkickfliponmyskateboard.Skatingintotheweekendlikeapro!,Excitement,8/8/2023 16:00,SkateProHighSchool,Twitter, #SkaterLife #HighSchoolSkater,30,60,Canada,2023,8,8,16
649,BondingwithfriendsoverthelatestK-popsensation.Fangirlingatitsfinest!,Joy,8/9/2023 22:30,KpopFangirlHighSchool,Facebook, #KpopFangirl #HighSchoolMusic,20,40,USA,2023,8,9,22
650,Spenthoursperfectingachemistryexperiment.Mixingpotionslikeawizard!,Joy,8/10/2023 14:20,ChemistryWizardHighSchool,Instagram, #ChemistryWizard #HighSchoolScientist,28,55,UK,2023,8,10,14
651,Successfullyorganizedasurprisebirthdaypartyforafriend.Partyplanningexpertmode:Achieved!,Joy,8/11/2023 18:45,BirthdayPartyPlannerHighSchool,Twitter, #BirthdayParty #HighSchoolCelebration,22,45,Canada,2023,8,11,18
652,"Joinedthedramaclubtounleashmyinneractor.Lights,camera,action!",Excitement,8/12/2023 13:45,DramaClubStarHighSchool,Facebook, #DramaClubStar #HighSchoolActor,25,50,USA,2023,8,12,13
653,Gotmyhandsonthelatestfantasynovel.Divingintorealmsofmagicandadventure!,Excitement,8/13/2023 20:00,FantasyBookNerdHighSchool,Instagram, #FantasyBookNerd #HighSchoolReader,35,70,UK,2023,8,13,20
654,Masteringtheartoftheperfectdoodleduringboringclasses.Doodles:A+!,Joy,8/14/2023 16:15,DoodleMasterHighSchool,Twitter, #DoodleMaster #HighSchoolArt,20,40,USA,2023,8,14,16
655,Attemptingtobreaktheschoolrecordforthelongesthandstand.Wishmeluck!,Excitement,8/15/2023 19:30,HandstandChallengeHighSchool,Facebook, #HandstandChallenge #HighSchoolAthlete,28,55,Canada,2023,8,15,19
656,Sneakingsnacksintoclasslikeapro.Theartofsnack-smugglingisasacredskill!,Mischievous,8/16/2023 14:00,SnackSmugglerHighSchool,Instagram, #SnackSmuggler #HighSchoolSnacks,30,60,USA,2023,8,16,14
657,Hostingasleepoverwithfriendsthisweekend.Preparingforanightoflaughterandmemories!,Excitement,8/17/2023 22:15,SleepoverHostHighSchool,Twitter, #SleepoverFun #HighSchoolMemories,18,35,UK,2023,8,17,22
658,"SpenthoursonaTikTokdance,onlytorealizeIhavetwoleftfeet.Dancefail:Unleashed!",Embarrassed,8/18/2023 16:30,TikTokFailHighSchool,Facebook, #DanceFail #HighSchoolTikTok,25,50,USA,2023,8,18,16
659,Accidentallylikedmycrush'soldphotowhilestalkingtheirprofile.Awkwardlevel:Maximum!,Embarrassed,8/19/2023 19:45,SocialMediaBlunderHighSchool,Instagram, #SocialMediaBlunder #HighSchoolAwkward,22,45,UK,2023,8,19,19
660,Triedtoimpressmycrushwithasmoothconversation.Endedupspillingmydrink.Smoothlevel:Nonexistent!,Embarrassed,8/20/2023 17:00,CrushFailHighSchool,Twitter, #CrushFail #HighSchoolEmbarrassment,30,60,Canada,2023,8,20,17
661,Masteredtheartofcreatingpaperairplanesduringlecture.Paperplanes:Soaringtonewheights!,Joy,8/21/2023 15:45,PaperPlaneExpertHighSchool,Instagram, #PaperPlaneExpert #HighSchoolArt,15,30,USA,2023,8,21,15
662,Tryingtosetanewtrendbyjugglingtextbooksbetweenclasses.Academicjuggling:Auniqueskill!,Excitement,8/22/2023 12:30,JugglingProHighSchool,Facebook, #TextbookJuggling #HighSchoolSkills,22,40,Canada,2023,8,22,12
663,Hidingasnackstashinmybackpackforemergencycravings.Snackninjamode:Activated!,Mischievous,8/23/2023 16:45,SnackNinjaHighSchool,Twitter, #SnackNinja #HighSchoolSnacks,28,55,USA,2023,8,23,16
664,Planningasurprisescavengerhuntforfriends.Anticipatingthethrillandexcitement!,Excitement,8/24/2023 18:20,ScavengerHuntMasterHighSchool,Instagram, #SurpriseAdventure #HighSchoolFun,20,38,UK,2023,8,24,18
665,Dancedintheraintocelebratetheendofexams.Raindance:Unexpectedlyrefreshing!,Joy,8/25/2023 14:15,RainDanceCelebrationHighSchool,Facebook, #RainDance #HighSchoolJoy,25,50,Canada,2023,8,25,14
666,Accidentallysentatextmeantforafriendtotheclassgroupchat.Textingfail:Oopsmoment!,Embarrassed,8/26/2023 17:30,GroupChatBlunderHighSchool,Twitter, #TextingFail #HighSchoolAwkward,18,35,USA,2023,8,26,17
667,Triedamagictricktoimpressclassmates.Magicfail:Wheredidthatrabbitgo?,Embarrassed,8/27/2023 20:45,MagicFailHighSchool,Instagram, #MagicFail #HighSchoolMagic,22,45,UK,2023,8,27,20
668,Perfectingtheartofcreatingorigamiduringadulllecture.Origamimastery:A+!,Joy,8/28/2023 16:00,OrigamiProHighSchool,Twitter, #OrigamiMaster #HighSchoolArt,18,36,USA,2023,8,28,16
669,Attemptingtosetanewrecordforthemostconsecutivehackysackkicks.Hackysackskills:Unleashed!,Excitement,8/29/2023 13:45,HackySackChampionHighSchool,Instagram, #HackySackChallenge #HighSchoolAthlete,26,48,Canada,2023,8,29,13
670,Creatingasecrethandshakewithfriends.Friendshiplevel:Expert!,Joy,8/30/2023 17:30,SecretHandshakeHighSchool,Facebook, #FriendshipGoals #HighSchoolMemories,20,40,USA,2023,8,30,17
671,Embarkingonamissiontofindthebestburgerjointintown.Burgerconnoisseur:Reportingforduty!,Excitement,8/31/2023 20:15,BurgerQuestHighSchool,Twitter, #BurgerQuest #HighSchoolFoodie,24,42,UK,2023,8,31,20
672,Practicingastand-upcomedyroutinefortheupcomingtalentshow.Comedygig:Inthemaking!,Joy,9/1/2023 14:45,ComedyGeniusHighSchool,Instagram, #StandUpComedy #HighSchoolTalent,21,39,Canada,2023,9,1,14
673,Accidentallysentalovelettertothewrongperson.Lovenotefail:Maximumembarrassment!,Embarrassed,9/2/2023 18:30,LoveLetterBlunderHighSchool,Facebook, #LoveLetterFail #HighSchoolAwkward,17,33,USA,2023,9,2,18
674,Attemptingtoimpresstheteacherwithanelaboratescienceexperiment.Sciencegeekmode:Activated!,Excitement,9/3/2023 22:00,ScienceExperimentProHighSchool,Twitter, #ScienceGeek #HighSchoolExperiments,23,44,UK,2023,9,3,22
675,Craftingintricatefriendshipbraceletsforthewholesquad.Friendshiplevel:Expertweaver!,Joy,9/4/2023 15:15,BraceletCraftsmanHighSchool,Instagram, #FriendshipBracelets #HighSchoolCrafts,19,37,USA,2023,9,4,15
676,Attemptingtobeattherecordforthemostconsecutivecartwheels.Cartwheelchallenge:Underway!,Excitement,9/5/2023 12:30,CartwheelMasterHighSchool,Twitter, #CartwheelChallenge #HighSchoolAthlete,27,52,Canada,2023,9,5,12
677,Organizingamoviemarathonwithfriends.Popcornandcinematicadventuresawait!,Joy,9/6/2023 16:45,MovieMarathonHostHighSchool,Facebook, #MovieNight #HighSchoolMemories,22,43,UK,2023,9,6,16
678,Experimentingwithanewhaircolor.Aboldchangeforaboldsemester!,Excitement,9/7/2023 18:20,HairColorExperimentHighSchool,Instagram, #HairExperiment #HighSchoolStyle,20,39,USA,2023,9,7,18
679,Buildingatimecapsuletocapturememoriesforthefuture.Time-travelingemotions!,Joy,9/8/2023 14:15,TimeCapsuleCreatorHighSchool,Facebook, #TimeCapsule #HighSchoolNostalgia,26,48,Canada,2023,9,8,14
680,Accidentallywalkedintothewrongclassroomonthefirstday.Classroommix-up:Awkwardstart!,Embarrassed,9/9/2023 17:30,ClassroomBlunderHighSchool,Twitter, #FirstDayOops #HighSchoolEmbarrassment,16,32,USA,2023,9,9,17
681,Tryingoutanewsmoothierecipeforahealthystarttotheweek.Smoothieenthusiast:Levelup!,Excitement,9/10/2023 20:45,SmoothieConnoisseurHighSchool,Instagram, #HealthyLiving #HighSchoolWellness,23,42,UK,2023,9,10,20
682,Reflectingonthechallengesoftheschoolyear.Feelingabitoverwhelmedwithassignments.,Sad,9/11/2023 15:45,OverwhelmedHighSchoolStudent,Twitter, #SchoolChallenges #HighSchoolStruggles,15,28,USA,2023,9,11,15
683,Encounteredsomemean-spiritedcommentsonline.Dealingwithonlinehateisnevereasy.,Hate,9/12/2023 12:30,DealingWithHateHighSchool,Instagram, #OnlineHate #HighSchoolReality,18,36,Canada,2023,9,12,12
684,Hadabaddayatschool.Everythingseemstobegoingwrong.,Bad,9/13/2023 16:45,ToughDayHighSchool,Facebook, #BadDay #HighSchoolBlues,20,40,UK,2023,9,13,16
685,Feelingdownafternotmakingthesportsteam.Disappointmentlingers.,Sad,9/14/2023 18:20,SportsTeamRejectionHighSchool,Twitter, #Disappointment #HighSchoolSports,17,34,USA,2023,9,14,18
686,Witnessedaheatedargumentinthecafeteria.Unpleasantatmosphereatlunch.,Hate,9/15/2023 14:15,CafeteriaConflictHighSchool,Instagram, #CafeteriaDrama #HighSchoolTension,21,41,Canada,2023,9,15,14
687,Receivedanot-so-greatgradeonamajorproject.Academicfrustrationsettingin.,Bad,9/16/2023 17:30,ProjectGradeDisappointmentHighSchool,Facebook, #AcademicFrustration #HighSchoolStress,19,38,UK,2023,9,16,17
688,Dealingwithapersonalsetback.Sometimeslifethrowsunexpectedchallenges.,Sad,9/17/2023 20:45,PersonalSetbackHighSchool,Twitter, #LifeChallenges #HighSchoolStruggles,22,44,USA,2023,9,17,20
689,FeelinglonelyonaSaturdaynight.Sometimessolitudehitsharderthanexpected.,Sad,9/18/2023 22:00,LonelySaturdayHighSchool,Instagram, #LonelyNights #HighSchoolEmotions,16,31,Canada,2023,9,18,22
690,Experiencingcyberbullying.Hatefulmessagesonlinearedisheartening.,Hate,9/19/2023 15:15,CyberbullyingVictimHighSchool,Facebook, #StopCyberbullying #HighSchoolReality,14,27,UK,2023,9,19,15
691,Caughtinatorrentialrainstormwithoutanumbrella.Today'sweatherisjustbadluck.,Bad,9/20/2023 12:30,RainyDayBluesHighSchool,Twitter, #BadLuck #HighSchoolWeather,18,35,USA,2023,9,20,12
692,Missinganimportanteventduetounforeseencircumstances.Adayfilledwithsadness.,Sad,9/21/2023 16:45,MissedOpportunityHighSchool,Instagram, #MissedChances #HighSchoolRegret,20,39,Canada,2023,9,21,16
693,Dealingwithunfoundedrumorscirculatingaboutpersonallife.Rumorscanbehurtful.,Hate,9/22/2023 18:20,RumorVictimHighSchool,Facebook, #RumorMills #HighSchoolDrama,23,46,UK,2023,9,22,18
694,Gotaflattireonthewaytoanimportantmeeting.Talkaboutaseriesofbadevents!,Bad,9/23/2023 14:15,FlatTireWoesHighSchool,Twitter, #BadLuckDay #HighSchoolStruggles,25,50,USA,2023,9,23,14
695,Feelingasenseofemptinessafteraclosefriendmovesaway.Farewellsarealwayssad.,Sad,9/24/2023 17:30,FriendMovingAwayHighSchool,Instagram, #SayingGoodbye #HighSchoolEmotions,21,42,Canada,2023,9,24,17
696,Facingrejectionfromadreamcollege.Disheartenedbutdeterminedtoexploreotherpaths.,Sad,9/25/2023 20:45,CollegeRejectionHighSchool,Facebook, #CollegeDreams #HighSchoolJourney,19,37,UK,2023,9,25,20
697,Encounteringonlinetoxicityduringagamingsession.Hatefulcommentscanruinthefun.,Hate,9/26/2023 14:15,GamingToxicityHighSchool,Twitter, #OnlineGaming #HighSchoolGamer,16,32,USA,2023,9,26,14
698,Havingabadhairdayandfeelingself-conscious.Badhairdayscanaffectconfidence.,Bad,9/27/2023 17:30,BadHairDayBluesHighSchool,Instagram, #BadHairDay #HighSchoolConfidence,18,36,Canada,2023,9,27,17
699,Feelingasenseofdespairafteramajorprojectfailure.Hardworkdidn'tpayoffthistime.,Sad,9/28/2023 22:00,ProjectFailureDespairHighSchool,Facebook, #ProjectStruggles #HighSchoolHardships,21,41,UK,2023,9,28,22
700,Experiencinghatecommentsforexpressingpersonalopinions.Onlinenegativityprevails.,Hate,9/29/2023 15:45,OpinionsHateHighSchool,Twitter, #OnlineOpinions #HighSchoolCriticism,24,48,USA,2023,9,29,15
701,Havingastringofbadluckwithconstanttechnologymalfunctions.Techtroublesgalore!,Bad,9/30/2023 18:20,TechMalfunctionWoesHighSchool,Instagram, #TechIssues #HighSchoolTech,22,43,Canada,2023,9,30,18
702,Missingoutonalong-anticipatedeventduetounexpectedcircumstances.Adayfilledwithsadness.,Sad,10/1/2023 14:15,MissedEventBluesHighSchool,Facebook, #MissedMoments #HighSchoolRegret,20,39,UK,2023,10,1,14
703,Tryingoutanewstudytechniqueforupcomingexams.Exploringdifferentlearningstrategies.,Neutral,10/2/2023 16:45,StudyTechniqueExperimentHighSchool,Instagram, #StudyStrategies #HighSchoolExams,23,42,USA,2023,10,2,16
704,Organizingacommunitycleanupeventforacleanerneighborhood.Promotingenvironmentalawareness.,Neutral,10/3/2023 12:30,CommunityCleanupHighSchool,Twitter, #EnvironmentalEfforts #HighSchoolCommunity,26,50,Canada,2023,10,3,12
705,Sharingfavoritebookrecommendationswithclassmates.Buildingaminibookclub.,Neutral,10/4/2023 18:20,BookRecommendationsHighSchool,Facebook, #BookClub #HighSchoolReads,19,38,UK,2023,10,4,18
706,Experimentingwithanewrecipeforaschoolbakesale.Bakingadventuresinthekitchen.,Neutral,10/5/2023 14:15,BakeSaleRecipeExperimentHighSchool,Instagram, #BakingAdventures #HighSchoolBakes,21,43,USA,2023,10,5,14
707,Collaboratingonaschoolprojectwithpeers.Teamworkmakesthedreamwork.,Neutral,10/6/2023 17:30,SchoolProjectCollaborationHighSchool,Twitter, #Teamwork #HighSchoolProjects,18,36,Canada,2023,10,6,17
708,Attendingaschoolclubmeetingtoexplorenewinterests.Dabblinginextracurricularactivities.,Neutral,10/7/2023 20:45,ExtracurricularExplorationHighSchool,Instagram, #SchoolClubs #HighSchoolInterests,22,45,UK,2023,10,7,20
709,Exploringanewpart-timejobopportunityforgainingworkexperience.Careerdevelopmentinprogress.,Neutral,10/8/2023 15:15,PartTimeJobExplorationHighSchool,Facebook, #CareerDevelopment #HighSchoolJobs,24,48,USA,2023,10,8,15
710,Attendingaschoolassemblytostayinformedaboutupcomingeventsandannouncements.Stayingconnectedwithschoolactivities.,Neutral,10/9/2023 22:00,SchoolAssemblyParticipationHighSchool,Twitter, #SchoolEvents #HighSchoolConnectivity,20,40,Canada,2023,10,9,22
711,Exploringanewhobbyofphotographyduringfreetime.Capturingmomentsthroughalens.,Neutral,10/10/2023 14:15,PhotographyHobbyHighSchool,Instagram, #PhotographyJourney #HighSchoolHobbies,25,49,UK,2023,10,10,14
712,Participatinginasciencefairtoshowcaseauniqueexperiment.Sharingknowledgewithpeers.,Neutral,10/11/2023 16:45,ScienceFairParticipationHighSchool,Facebook, #ScienceFair #HighSchoolScience,19,37,USA,2023,10,11,16
713,Attendingaworkshopontimemanagementtoenhanceorganizationalskills.Strivingforefficiency.,Neutral,10/12/2023 18:20,TimeManagementWorkshopHighSchool,Twitter, #EfficiencyGoals #HighSchoolSkills,23,44,Canada,2023,10,12,18
714,Volunteeringatalocalcharityeventtogivebacktothecommunity.Contributingtosocialcauses.,Neutral,10/13/2023 12:30,CharityEventVolunteerHighSchool,Instagram, #CommunityService #HighSchoolVolunteer,20,39,UK,2023,10,13,12
715,Collaboratingonagroupprojecttopromoteteamworkandsharedresponsibilities.Groupeffortinaction.,Neutral,10/14/2023 17:30,GroupProjectCollaborationHighSchool,Facebook, #TeamSpirit #HighSchoolProjects,18,35,USA,2023,10,14,17
716,Participatinginadebateclubtoenhancecriticalthinkingandcommunicationskills.Intellectualengagementinprogress.,Neutral,10/15/2023 20:45,DebateClubParticipationHighSchool,Twitter, #DebateSkills #HighSchoolIntellect,22,43,Canada,2023,10,15,20
717,Celebratingafriend'sbirthdaywithasurpriseparty.Joyfulmomentsandlaughterallaround!,Happy,10/16/2023 15:45,BirthdaySurpriseHighSchool,Instagram, #SurpriseParty #HighSchoolCelebration,27,52,UK,2023,10,16,15
718,Successfullycompletingachallengingcodingproject.Excitementforovercomingcodinghurdles!,Happy,10/17/2023 12:30,CodingSuccessHighSchool,Twitter, #CodingTriumph #HighSchoolTech,24,48,USA,2023,10,17,12
719,Attendingaschooltalentshowtosupportclassmates.Applaudingthediversetalentsondisplay!,Happy,10/18/2023 16:45,TalentShowSupportHighSchool,Facebook, #TalentShow #HighSchoolEntertainment,19,38,Canada,2023,10,18,16
720,"Exploringanewhikingtrailwithfriendsovertheweekend.Nature,laughter,andgoodvibes!",Happy,10/19/2023 18:20,WeekendHikeHighSchool,Instagram, #NatureAdventures #HighSchoolFriends,21,42,UK,2023,10,19,18
721,Winningafriendlysportscompetitionagainstrivalschools.Victorycelebrationsinfullswing!,Happy,10/20/2023 14:15,SportsVictoryHighSchool,Twitter, #SportsTriumph #HighSchoolAthletics,26,50,USA,2023,10,20,14
722,Receivingaheartfeltletterfromapenpalinanothercountry.Connectingacrosstheglobe!,Happy,10/21/2023 17:30,PenPalConnectionHighSchool,Facebook, #GlobalFriendship #HighSchoolCorrespondence,23,45,Canada,2023,10,21,17
723,Creatingabeautifulmuralwithfellowartenthusiasts.Thepowerofcollaborationandcreativity!,Happy,10/22/2023 20:45,MuralCreationHighSchool,Instagram, #ArtCollaboration #HighSchoolCreativity,22,43,UK,2023,10,22,20
724,Participatinginaschool-wideartexhibition.Witnessingcreativityandspreadingpositivevibes!,Happy,11/10/2015 16:45,ArtExhibitionJoyHighSchool,Instagram, #ArtisticExpression #HighSchoolCreativity,23,44,USA,2015,11,10,16
725,Achievingapersonalbestinatrackandfieldcompetition.Thethrillofvictoryandself-improvement!,Happy,9/14/2016 12:30,TrackFieldSuccessHighSchool,Twitter, #AthleticAchievement #HighSchoolSports,26,51,Canada,2016,9,14,12
726,Collaboratingonascienceprojectthatreceivedrecognitionataregionalfair.Sciencetriumphsandsmiles!,Happy,8/18/2017 18:20,ScienceProjectSuccessHighSchool,Facebook, #ScienceFairWinner #HighSchoolScience,20,39,UK,2017,8,18,18
727,"Attendingasurprisebirthdaypartyorganizedbyfriends.Surroundedbylove,laughter,andgoodcompany!",Happy,6/22/2018 14:15,BirthdayPartyJoyHighSchool,Instagram, #SurpriseCelebration #HighSchoolFriendship,25,48,USA,2018,6,22,14
728,Successfullyfundraisingforaschoolcharityinitiative.Thejoyofgivingbacktothecommunity!,Happy,4/5/2019 17:30,CharityFundraisingTriumphHighSchool,Twitter, #CommunityGiving #HighSchoolPhilanthropy,22,42,Canada,2019,4,5,17
729,"Participatinginamulticulturalfestival,celebratingdiversitywithmusic,dance,anddeliciousfood!",Happy,2/29/2020 20:45,MulticulturalFestivalJoyHighSchool,Facebook, #CulturalCelebration #HighSchoolUnity,21,43,UK,2020,2,29,20
730,"Organizingavirtualtalentshowduringchallengingtimes,bringingsmilestoclassmates'faces!",Happy,11/15/2020 15:15,VirtualTalentShowSuccessHighSchool,Instagram, #VirtualEntertainment #HighSchoolPositivity,24,47,USA,2020,11,15,15
